Article Title,Article Link,Article Text,Article Summary,Article Image
Evening news wrap: Pak furious as UN questions 27th amendment; IAF launches big rescue op in Sri Lanka & more,https://timesofindia.indiatimes.com/india/evening-news-wrap-pak-furious-as-un-questions-27th-amendment-iaf-launches-big-rescue-op-in-sri-lanka-more/articleshow/125672646.cms,"Evening news wrap, Nov 30

‘4,000 Soldier Deaths, 20,000 Injured’: Pak FM Ishaq Dar Blames Taliban For Troop Losses

Here are the top 5 updates from the day:

Pak

criticises UN top official for remarks on 27th constitutional amendment

Watch

IAF choppers rescue civilians in flood-hit Sri Lanka under

Operation Sagar Bandhu

ECI raps Bengal's TMC govt for not paying BLOs increased honorarium

Andre Russell takes on role in Kolkata Knight Riders

India imported 5.4 million tonnes of Russian oil from 'shadow fleet' says CREA

Catch up on today’s key developments across politics, sports, business, and major global events. Pakistan rejected UN rights chief Volker Türk’s criticism of its 27th constitutional amendment, calling his remarks biased. In Sri Lanka, watch Chetak helicopters from INS Vikrant conduct search-and-rescue missions under Operation Sagar Bandhu.Meanwhile, the election commission reprimanded the West Bengal government for not releasing approved payments to BLOs during the ongoing electoral roll revision.In sports, Kolkata Knight Riders star player Andre Russell announced his retirement from IPL after a decade with the team, but will take on a new role.A CREA report said India imported 5.4 million tonnes of Russian oil via 30 falsely flagged vessels between January and September 2025.Pakistan on Sunday brushed aside UN High Commissioner for Human Rights Volker Türk’s concerns over the recent 27th Constitutional Amendment, urging him to refrain from comments driven by “political bias and misinformation.”“In line with all parliamentary democracies, legislation and any amendment to the Constitution fall solely within the purview of the elected representatives of the people of Pakistan,” the Foreign Office (FO) said in a statement.Under Operation Sagar Bandhu, Chetak helicopters from INS Vikrant conducted search-and-rescue missions across Sri Lanka over the weekend, aiding those affected by the floods.A video released by the Indian High Commission in Colombo shows personnel deploying ropes, harnesses, and inflatable rafts from the aircraft to reach stranded residents, who are seen swimming toward the rescue lines before being airlifted to safety.The Election Commission of India (ECI) has criticised the West Bengal government for not releasing the enhanced honorarium for booth-level officers (BLOs) or the additional funds sanctioned for the ongoing special intensive revision (SIR) of electoral rolls.In a statement, the Commission said it had conveyed to an All India Trinamool Congress delegation during a November 28 meeting that the delay in clearing these payments was “very strange.”Kolkata Knight Riders’ star allrounder Andre Russell has announced his retirement from the Indian Premier League, bringing an end to his decade-long stint with the franchise. The 37-year-old will now move into the team’s support staff, taking on the role of “Power Coach” starting with the 2026 season.Russell shared the news on Instagram, thanking KKR fans and reflecting on a career filled with towering sixes, clutch finishes, and multiple MVP titles.India imported 5.4 million tonnes of Russian oil worth 2.1 billion euros between January and September 2025 using 30 tankers that allegedly sailed under false flags, a European think tank has reported.The Centre for Research on Energy and Clean Air (CREA) said these shipments made India the biggest destination for crude transported by Russia’s expanding “shadow fleet” that has emerged in response to Western energy sanctions imposed after Moscow’s full-scale invasion of Ukraine.","Pakistan rejects UN rights chief Volker Türk’s criticism of its 27th constitutional amendment. In Sri Lanka, watch Chetak helicopters from INS Vikrant conduct search-and-rescue missions under Operation Sagar Bandhu. Kolkata Knight Riders star player Andre Russell announced his retirement from IPL after a decade with the team.","https://static.toiimg.com/thumb/msid-125672971,imgsize-934946,width-400,resizemode-4/.jpg"
"Show results of anti-pollution steps: SC to Centre, NCR govts",https://timesofindia.indiatimes.com/india/show-results-of-anti-pollution-steps-sc-to-centre-ncr-govts/articleshow/125706824.cms,"'We Can’t Breathe': Activists, Parents, Kids Held During Delhi Clean-Air Protest At India Gate

Measures must be implemented round the year, says apex court

NEW DELHI: Supreme Court on Monday bristled at attempts to pin the blame for Delhi-NCR air pollution on farm fires and asked the Union and NCR govts to detail measures taken on other pollution sources — vehicles, industries, construction, dust — and the tangible results achieved through implementation of such steps.Amicus curiae and senior advocate Aparajita Singh and additional solicitor general Aishwarya Bhati said stubble burning incidents contribute to pollution in Delhi-NCR for just 15 days in winter months, but there are other major causes of pollution which need to be addressed round the year.In defence of farmers, a bench of CJI Surya Kant and Justice Joymalya Bagchi said, “Let stubble burning not be made a political or ego issue. During Covid (lockdown), stubble burning was there. Yet, we could see stars in the night sky. You (govt) say measures have been taken. Still, we can’t see stars. What are the tangible results achieved through enforcement of graded action plan (Grap)? What actions have been taken against other sources of pollution?”What is being done about high-end gas guzzlers, the bench asked. “Strengthening quality public transport is key to reducing vehicular contribution towards air pollution. But that will take time and should be part of the long-term plan,” it said, adding that financial empowerment of people in India has led to a burgeoning number of cars in the capital city, which was not planned to accommodate so many people with individual vehicles.As Bhati informed the court that the number of incidents of stubble burning has gradually gone down in the states of Punjab, Haryana and Rajasthan, the bench asked if there has been corresponding improvement in air quality in Delhi-NCR. “Normatively, you might have banned construction activities but is there sincere implementation on the ground?”Bhati admitted that Grap restrictions have not been scrupulously enforced.The bench said that both short-term and long-term measures require intensive implementation round the year and promised that matters relating to air pollution would be heard by SC at least twice a month round the year.Senior advocate Ranjit Kumar said all thermal power plants were required to implement sulphur dioxide emission control measures, primarily by installing the Flue Gas Desulphurisation (FGD) system, by 2021.The deadline has been extended by the govt several times, and now the thermal power plants have been asked to implement the emission control measure by 2027-29, he said.When Bhati said that the govt has already filed both short-term and long-term plans to tackle the problem of air pollution, the bench asked why they are not been revisited if they have not been able to reduce pollution.On many occasions, the rural-urban bias of experts results in misdirection of efforts to curb pollution, it said, and suggested that experts aware of ground realities of India, not those who studied at Harvard or other foreign universities, prepare action plans.The bench posted the matter for further hearing on Dec 10.","Supreme Court bristled at attempts to pin the blame for Delhi-NCR air pollution on farm fires. The court asked the Union and NCR govts to detail measures taken on other pollution sources. “Strengthening quality public transport is key to reducing vehicular contribution towards air pollution,” it said.","https://static.toiimg.com/thumb/msid-125706832,imgsize-615720,width-400,resizemode-4/-.jpg"
SC refuses to grant more time for waqf detail upload on portal,https://timesofindia.indiatimes.com/india/sc-refuses-to-grant-more-time-for-waqf-detail-upload-on-portal/articleshow/125707059.cms,"With the deadline approaching on Dec 6, a batch of petitions sought more time on various grounds, including technical glitches encountered in accessing the UMEED portal

Supreme Court Stays Key Provisions Of Waqf Amendment Act, Refuses To Suspend Other Proposals

NEW DELHI: Supreme Court on Monday refused to extend time for the mandatory registration of all waqf properties on the UMEED portal and asked those who have not done so to approach the tribunal constituted under Waqf (Amendment) Act, which has the power to extend the period by six months.Running against time to comply with registration as the deadline is to expire on Dec 6, a batch of petitions were filed in the apex court, including by All India Muslim Personal Law Board, for extension of time on various grounds including because of technical glitches encountered in accessing the portal. But the Centre strongly opposed the plea saying the Act states the extension can be granted by the waqf tribunal and aggrieved persons should approach it.Appearing before a bench of Justices Dipankar Datta and A G Masih, senior advocates Kapil Sibal, A M Singhvi and M R Samshad said that so far, only around 1.6 lakh properties had been uploaded, and while the total number of such assets might be above 10 lakh, it would be difficult to upload details within the short span of time.Solicitor general Tushar Mehta, however, said the court’s interference to extend the date would amount to amending the law itself which provided six months time.He also told SC the issue can be examined by the tribunal.Section 3B of the Waqf (Amendment) Act, 2025 says every waqf registered under this Act shall file the details of the waqf and the property dedicated to the waqf on the portal and database, within a period of six months from such commencement. It, however, provides that the tribunal may, on an application made to it by the mutawalli, extend such period of six months under this section for a further period not exceeding six months as it may consider appropriate, if he satisfies the tribunal that he had sufficient cause for not filing the details of the waqf on the portal within such period.Taking note that the issue could be examined by the tribunal, the bench refused to extend the time. SC said that facing technical problems in uploading details of the properties would be a valid ground to seek a further six months time from the tribunal. “Technical glitch is a very good reason to seek extension from tribunal,” the bench said.The court had in Sept declined to stay many of the provisions under challenge in a batch of petitions challenging the amendments, including the requirement for all waqfs to be registered under section 3B, considering such a registration requirement was there earlier as well.","Supreme Court on Monday refused to extend time for the mandatory registration of all waqf properties on the UMEED portal. A batch of petitions were filed in the apex court, including by All India Muslim Personal Law Board, for extension of time on various grounds. The Centre strongly opposed the plea saying the Act states the extension can be granted by the Waqf tribunal.","https://static.toiimg.com/thumb/msid-125707105,imgsize-1281843,width-400,resizemode-4/with-the-deadline-approaching-on-dec-6-a-batch-of-petitions-sought-more-time-on-various-grounds-including-technical-glitches-encountered-in-accessing-the-umeed-portal.jpg"
SIR debate demand wipes out Day 1 of winter session,https://timesofindia.indiatimes.com/india/sir-debate-demand-wipes-out-day-1-of-winter-session/articleshow/125706228.cms,"Watch: MPs Speak Out as SIR Row Dominates Winter Session Opening

You can’t dictate timeline for govt call on

SIR debate

, Rijiju tells oppn

NEW DELHI: Opposition parties disrupted proceedings in Lok Sabha and walked out of Rajya Sabha on the first day of the winter session after govt refused to concede their demand to immediately allow a debate on the special intensive revision (SIR) of electoral rolls being conducted by Election Commission.They rejected the stand of parliamentary affairs minister Kiren Rijiju that the demand for debate over SIR was under consideration but govt could not be tied to a timeline.The forthcoming days are likely to see more disruptions as there is no indication that the govt might relent on its stand not to discuss the functioning of Election Commission, an independent body. The opposition is determined to force the issue and chose the path of confrontation despite misgivings among smaller INDIA bloc parties.There are signs suggesting that Trinamool is ploughing its own furrow in the matter (special intensive revision of electoral rolls being conducted by Election Commission) rather than following Congress. At a meeting of the grouping, leader of opposition in Lok Sabha, Rahul Gandhi, is learnt to have repeated his “vote manipulation” charge — a clear sign that Congress would remain hewed to its stand opposing special intensive revision.There were repeated adjournments in the first half of the session as opposition shouted slogans disregarding Lok Sabha Speaker Om Birla’s appeal not to do so. “You can raise slogans outside but not in the House,” he said. A bill introduced by finance minister Nirmala Sitharaman to implement amendments to GST law in Manipur was passed in Lok Sabha amid the din.Sitharaman also introduced in Lok Sabha two new bills that seek to repurpose levies on ‘sin goods’ such as tobacco, pan masala and related products. However, with opposition persisting with its slogan shouting, the House had to be adjourned for the day in the second half.In Rajya Sabha, opposition MPs were on their feet to press their demand soon after the felicitation of chairman C P Radhakrishnan, who chaired the proceedings for the first time since his election as Vice President in Sept this year.TMC member Derek O’Brien said that parliamentary affairs minister Kiren Rijiju had promised them on Sunday to get back to them on their demand that SIR should be taken up under the broader agenda of “electoral reforms”. Leader of opposition in Rajya Sabha, Mallikarjun Kharge, and CPM’s John Brittas joined in the demand.They cited suicides by booth-level officers (BLOs) due to alleged workload, with Kharge calling for taking up the debate on SIR first as they have been demanding it since last session.Rijiju reiterated that their demand is under govt’s consideration and that he would get back as soon as possible. “Nobody is undermining the matter taken up by opposition. It is under consideration of govt. But you cannot impose conditions like taking up the discussion today. There are opposition parties other than a dozen (demanding debate on SIR), who represent different states and want discussion on other issues,” he said. Opposition MPs told Rijiju that he had promised on Sunday to convey to them govt’s decision by 9pm the same day. Rijiju, however, said opposition cannot dictate a timeline.“Timeline is not the problem. But there is a trust deficit,” retorted Derek. Opposition members then staged a walkout in protest, following which the Chair took up special mentions and Zero Hour.Opposition functionaries said that they will continue to stick to their demand for SIR discussion on Tuesday and will take stock of the situation on Wednesday amid slender hope in its ranks that govt could agree.INDIA bloc will protest against the SIR at the Parliament entrance on Tuesday morning, in what will be reminiscent of the Monsoon session that was washed out over protests against ‘vote chori’.Many eyebrows were raised when Trinamool did not join the meeting of INDIA bloc held at Congress’s initiative. Also, smaller parties from Kerala like CPI, CPM, RSP and IUML felt that complete washout of proceedings should be avoided as there were important issues to be highlighted.Congress president Kharge sympathised with them, but said the issue of SIR is important and govt should accept the demand for discussion even if it is under some other subject like “electoral reforms”.But, sources said, a difference of views was the reason why opposition has decided to take a fresh look at the issue after two days.",Opposition parties disrupted proceedings in Lok Sabha and walked out of Rajya Sabha on the first day of the winter session. They rejected the stand of parliamentary affairs minister Kiren Rijiju that the demand for debate over SIR was under consideration.,"https://static.toiimg.com/thumb/msid-125706299,imgsize-1813990,width-400,resizemode-4/-.jpg"
Privacy alarm rings as govt directs smartphone makers to pre-load Sanchar Saathi app,https://timesofindia.indiatimes.com/india/privacy-alarm-rings-as-govt-directs-smartphone-makers-to-pre-load-sanchar-saathi-app/articleshow/125699029.cms,"Sanchar Saathi mobile app

Political Storm Over Sanchar Saathi As Opposition Calls It A Snooping Tool, Govt Defends Move

In what raises privacy concerns and fears around state surveillance, govt has asked smartphone makers to mandatorily pre-install its Sanchar Saathi app on their devices, ostensibly to strengthen cyber security on the devices and prevent tampering and spoofing of IMEI (International Mobile Equipment Identity) number.The order, originally issued on November 21, gives the device makers – ranging from Apple, Samsung, Google, Motorola, and the Chinese lot of Xiaomi, Oppo and Vivo – 90 days to comply with the regulation or otherwise face penalties. The govt’s order is even valid for devices being imported to the country, or still in pre-sales transit.The direction -- that raised red flags within the industry as well as privacy advocates -- said, “Central govt hereby directs every manufacturer and importers of mobile handsets that are intended for use in India to… ensure that the Sanchar Saathi mobile application, as specified by Department of Telecom (DoT), is pre-installed on all mobile handsets manufactured or imported for use in India.”And to ensure that the exercise does not end up as mere eyewash, the order also asks the companies to ensure that the pre-installed Sanchar Saathi app is “readily visible and accessible to the end users” at the time of first use or device setup and that “its functionalities are not disabled or restricted”.The order said that a provision to follow the instructions should also be made for devices which are in transit for sales.“For all such devices that have already been manufactured and are in sales channels in India, the manufacturer and importers of mobile handsets shall make an endeavour to push the App through software updates.”Sanchar Saathi is pitched as a citizen-centric initiative of DoT that promises to “empower mobile subscribers, strengthen their security” while increasing awareness about govt initiatives.The direction has been given under the Telecommunications (Telecom Cyber Security) Rules, 2024, and its further amendments. “Rule 5 of the Rules empowers the govt to establish digital or other mechanisms necessary to identify and report acts that may endanger telecom cyber security, and accordingly, the DoT has instituted the Sanchar Saathi App, that, inter-alia, enables stakeholders to report IMEI related suspicious misuse and also to verify authenticity of IMEIs used in mobile devices,” the order said.The order said that mobile handsets bearing duplicate or spoofed IMEI pose serious danger to telecom cyber security.Govt instructed the manufacturer and importers of mobile handsets to submit compliance reports to the DoT within 120 days from issue of the directions. “Failure to comply with these directions shall attract action under the Telecommunications Act, 2023, the Telecom Cyber Security Rules, 2024 (as amended), and other applicable laws.”","The order, originally issued on November 21, gives the device makers – ranging from Apple, Samsung, Google, Motorola, and the Chinese lot of Xiaomi, Oppo and Vivo – 90 days to comply with the regulation. The govt’s order is even valid for devices being imported to the country, or still in pre-sales transit.","https://static.toiimg.com/thumb/msid-125699030,imgsize-4196,width-400,resizemode-4/sanchar-saathi-mobile-app-crosses-50-lakh-mark-downloads-in-six-months-of-launch.jpg"
'Moment of pride': India's poll process gets global recognition; comes amid oppn's SIR attack,https://timesofindia.indiatimes.com/india/moment-of-pride-indias-poll-process-gets-global-recognition-comes-amid-oppns-sir-attack/articleshow/125696548.cms,"Chief election commissioner Gyanesh Kumar (Image credits: ANI)

Winter Session Of Parliament: Bills On Atomic Energy, Excise On Agenda; Oppn Gears Up For SIR

NEW DELHI: Chief election commissioner Gyanesh Kumar on Monday informed that India has been invited to chair the International Institute for Democracy and Electoral Assistance (International IDEA) for the first time, gaining recognition for its electoral process.Commenting on this achievement, he said, ""The world recognises the successful conduct of free, fair and transparent elections in India. Therefore, for the first time in its history of 30 years, the group of 37 democratic countries of the world have invited India to chair the International Institute for Democracy and Electoral Assistance, International IDEA,” said Kumar.“This is a moment of immense pride for the citizens of India and all the Election Commission officials,” he added, as quoted by ANI.The Election Commission stated that Kumar will formally assume the Chair of International IDEA on December 3, 2026, in Stockholm, Sweden, representing India. The organisation comprises 37 democratic nations.Founded in 1995, International IDEA is an inter-governmental body with 35 member nations, while the United States and Japan participate as Observers. It has held observer status at the UN General Assembly since 2003.India, a founding member, has played an active role in shaping governance frameworks, conducting electoral research, and implementing training and capacity-building programmes.As the world’s largest democracy, India brings experience managing over 90 crore registered voters. This expertise is expected to strengthen Election Management Bodies worldwide during its tenure as Chair.Within the organisation’s membership and observer nations, India has the largest number of registered voters, with 991 million, representing 44.5 per cent of the total electorate of 2,225,549,481. The United States comes next with 234,504,358 voters, followed by Indonesia with 204,421,612.Other major contributors include Brazil, Japan, Mexico, and the Philippines, while smaller countries such as Luxembourg, Cabo Verde, and Barbados have far fewer electors.","Chief election commissioner Gyanesh Kumar on Monday informed that India has been invited to chair the International Institute for Democracy and Electoral Assistance. Kumar will formally assume the Chair of International IDEA on December 3, 2026, in Stockholm, Sweden, representing India.","https://static.toiimg.com/thumb/msid-125696565,imgsize-688929,width-400,resizemode-4/untitled-design-24.jpg"
