Article Title,Article Link,Article Text,Article Summary,Article Image
"Bank scams: Vijay Mallya, Nirav Modi, other fugitives owe over Rs 58,000 crore; government says only 33% amount recovered",https://timesofindia.indiatimes.com/business/india-business/bank-scams-vijay-mallya-nirav-modi-other-fugitives-owe-over-rs-58000-crore-government-says-only-33-amount-recovered/articleshow/125696908.cms,"NEW DELHI: Fugitive economic offenders collectively owed more than Rs 58,082 crore to Indian public sector banks, the Union finance ministry informed Lok Sabha on Monday. The figure included Rs 26,645 crore in principal and Rs 31,437 crore in accumulated interest as of October 31, 2025.The ministry said that a total of 15 individuals, including Vijay Mallya and Nirav Modi , have been declared Fugitive Economic Offenders (FEOs) under the Fugitive Economic Offenders Act, 2018, of which nine are linked to major financial frauds involving public sector banks.The government Vijay Mallya's Kingfisher Airlines-related accounts show one of the largest exposures, with the State Bank of India reporting Rs 6,848.28 crore in principal dues, which rise to Rs 11,960.05 crore after interest. Multiple other PSU banks also report unpaid amounts linked to him.Nirav Modi, through various entities including Firestar and diamond group companies, owes more than Rs 7,800 crore in principal alone. The single largest line item is Rs 6,799.18 crore under Punjab National Bank’s ""non-borrowal fraud"" category. His accounts also feature across SBI, Bank of India, Canara Bank, Indian Bank and others.Companies linked to the Sandesara family (Sterling Biotech, Sterling SEZ, Sterling Global Oil Resources and related entities) appeared in several loan accounts across multiple banks.Some of the biggest exposures include Rs 1,392.78 crore owed to Bank of India and Rs 982.50 crore to the State Bank of India.As of now, banks have managed to recover Rs 19,187 crore from all fugitive offenders so far, according to the finance ministry. This means that out of the Rs 58,082 crore owed, about Rs 38,895 crore remains unpaid, outstanding principal and interest that banks have not been able to recover yet.The government also told the House that only two fugitive offenders have negotiated One-Time Settlements (OTS): Nitin and Chetan Sandesara with Indian Bank, and Sterling Global Oil Resources Pvt Ltd with the State Bank of India.In response to whether a policy is being drafted to prevent economic offenders from leaving the country, the government said that no such proposal is currently under consideration.","Fugitive economic offenders collectively owed more than Rs 58,082 crore to Indian public sector banks. The figure included Rs 26,645 crore in principal and Rs 31,437 crore in accumulated interest as of October 31, 2025. Vijay Mallya's Kingfisher Airlines-related accounts show one of the largest exposures.","https://static.toiimg.com/thumb/msid-125696960,imgsize-809568,width-400,resizemode-4/file-photo.jpg"
Smriti Mandhana wedding postponed: Has Palash Muchhal also deleted Instagram posts?,https://timesofindia.indiatimes.com/sports/cricket/news/smriti-mandhana-wedding-postponed-has-palash-muchhal-also-deleted-instagram-posts/articleshow/125699042.cms,"Smriti Mandhana & Palash Muchhal Add Evil Eye Emoji To Bios Amid Cheating Rumours!

Indian women’s cricket team vice-captain Smriti Mandhana and music composer Palash Muchhal ’s wedding, which was scheduled for November 23, was postponed after unexpected health emergencies in the family.The sequence began when Mandhana’s father, Shriniwas, fell ill on the wedding day and had to be taken to a hospital. A day later, groom-to-be Palash Muchhal was also admitted to a hospital in Sangli, which is Mandhana’s hometown. He was then moved to Mumbai for further treatment and rest.Mandhana’s manager confirmed the postponement and said the families decided to delay the wedding because of these health-related developments. After the announcement, Mandhana removed all wedding-linked posts from her official Instagram account. However, some other photographs with Palash are still available on his social media pages.Both Shriniwas and Palash have now been discharged from the hospital and are recovering. However, the families have not announced a revised date for the ceremony.There has been interest in whether Palash also deleted his wedding content.As of Monday, he has not removed the video of him proposing to Smriti Mandhana. The proposal took place at the DY Patil Stadium in Navi Mumbai, which is the same venue where the Indian women’s team won the Women’s World Cup 2025. Palash uploaded this proposal video on Instagram on November 21.Meanwhile, Team India batter Jemimah Rodrigues, who is a close friend of Mandhana, has withdrawn from the remaining matches of the Women’s Big Bash League (WBBL) to stay with her during this period. The postponement has come only weeks after India’s win in the ICC Women’s ODI World Cup, where Mandhana played a major role in the team’s campaign.",Smriti Mandhana and Palash Muchhal’s wedding was scheduled for November 23. The wedding was postponed after unexpected health emergencies in the family. The postponement has come only weeks after the ICC Women's ODI World Cup. Team India batter Jemimah Rodrigues has withdrawn from the remaining matches of the Women's Big Bash League (WBBL) to stay with her during this period.,"https://static.toiimg.com/thumb/msid-125699074,imgsize-43328,width-400,resizemode-4/smriti-mandhana-and-palash-muchhal.jpg"
'What a welcome!': Virat Kohli showered with red flowers by young fans in Raipur – Watch,https://timesofindia.indiatimes.com/sports/cricket/india-vs-south-africa/what-a-welcome-virat-kohli-showered-with-red-flowers-by-young-fans-in-raipur-watch/articleshow/125709848.cms,Virat Kohli reached Raipur for the second ODI against South Africa. He scored 135 runs in the first match. Young fans greeted him warmly at the hotel. India won the first ODI by 17 runs. Kohli's century and bowlers' performance were key. Their future World Cup selection may depend on playing the Vijay Hazare Trophy.,Virat Kohli reached Raipur for the second ODI against South Africa. Young fans greeted him warmly at the hotel. India won the first ODI by 17 runs. Their future World Cup selection may depend on playing the Vijay Hazare Trophy.,"https://static.toiimg.com/thumb/msid-125709899,imgsize-1079643,width-400,resizemode-4/virat-kohli.jpg"
IITs bar from placement drive 20+ companies that rescinded offers,https://timesofindia.indiatimes.com/india/iits-bar-from-placement-drive-20-companies-that-rescinded-offers/articleshow/125706903.cms,"An IIT professor said the institutes have also decided to emphasise more on participation by start-ups promoted by Centre under Viksit Bharat scheme

Also read:

MUMBAI: Even as the placement season began across the premier IITs on Monday, more than 20 companies were banned from participating this year. These firms had rescinded job offers made to students in the last academic year, some even as late as June or July this year, at the time of joining. Since many IITs do not allow students with existing offers to sit for further interviews, such late withdrawals not only jeopardised career prospects but also affected students’ mental well-being, said officials. IITs, therefore, unanimously decided to ban these companies from the current placement cycle. IITs tried helping the concerned students despite the time lapse.The list of banned companies was finalised after these firms revoked offers at more than one IIT. Some of them are data analytics and software-based firms. They, however, are allowed to place students through off-campus process.An IIT professor involved in the placement process said the names of the companies were cross-verified by placement coordinators at 15 IITs recently. “We looked at their past records too. Some of these companies had a history of revoking offers and six to seven IITs had already banned them from participation.Offers have been revoked by some companies where some alumni are working. There were also a few companies that reduced salary packages offered in the letter. The placement cells are trying to speak to higher authorities in these companies,” said the professor.Speaking about such cancellations, a computer science graduate from IIT-Bombay’s batch of 2025, said he was hired by a trading platform last December and his joining date was June 1, 2025. “My offer was revoked on May 29. The company made me an offer of nearly Rs 30 lakh and I was more than happy to join. They revoked my offer just two days before I was supposed to join, but fortunately, I got a better offer through an alumnus in some time. Though IIT-Bombay extended help, I did not need it at that time,” said the graduate. He said some of his friends’ offers were revoked too, but a few of them landed other offers. “By June and July it becomes difficult for the institutes too to help with placements as phase-II of the process concludes by the end of the academic year,” he said.The professor added that the IITs this year have also decided to emphasise more on participation by start-ups promoted by the Centre under the Viksit Bharat programme. “The job market is slow, but we are trying to reach out to many more companies and encourage start-ups incubated on prominent campuses to reach the best targets,” he said, adding that so far the placement season looks good.","Firms had rescinded job offers made to students in the last academic year. Some even as late as June or July this year, at the time of joining. IITs unanimously decided to ban these companies from the current placement cycle. Some of them are data analytics and software-based firms.","https://static.toiimg.com/thumb/msid-125706936,imgsize-1021594,width-400,resizemode-4/an-iit-professor-said-the-institutes-have-also-decided-to-emphasise-more-on-participation-by-start-ups-promoted-by-centre-under-viksit-bharat-scheme.jpg"
"Asia’s arms race shift: India climbs, China slides on PLA graft charges",https://timesofindia.indiatimes.com/india/sipri-2024-arms-report-india-and-china-arms-race-xi-jinping-pla-purge/articleshow/125696987.cms,"TL;DR: Driving the news

Zoom in

India’s steady climb

Why it matters

China’s disrupted march

Xi's purge table

Combined revenues fell by 10% to $88.3 billion

Between the lines

The big picture: Asia’s arms balance shifts

Global context: Arms race accelerating

Russia and the Middle East: War economies and new hubs

What’s next

The bottom line

Global arms revenues surged to an all-time high of $679 billion in 2024, up 5.9% in real terms, according to the latest SIPRI Top 100 ranking. While Europe and the US drove most of the increase, Asia and Oceania stood out as the only region to post a decline—largely due to a dramatic drop in Chinese arms company revenues, the SIPRI report said.India, though still far from being a global arms giant, posted a quiet but steady 8.2% increase in combined revenues across its three Top 100 companies. In sharp contrast, Chinese arms revenues fell 10%, a setback tied to a wave of high-profile corruption scandals and major contract delays that rattled Beijing's defense establishment.India’s three Top 100 firms-Hindustan Aeronautics Ltd (HAL), Bharat Electronics Ltd (BEL), and Mazagon Dock Shipbuilders-together pulled in $7.5 billion in arms revenue in 2024, up from $6.9 billion in 2023.BEL led the growth with a 24% revenue jump, hitting $2.47 billion. The boost came from domestic orders, particularly in radar systems and electronic warfare equipment, both prioritized in India’s military modernization drive.HAL, India’s top-ranked defense firm at rank 44 globally, earned $3.81 billion, a marginal 0.3% decrease from the previous year. The company faced delivery lags, but remained a cornerstone supplier to the Indian Air Force and Navy.Mazagon Dock, focused on naval shipbuilding, recorded $1.23 billion in arms revenue, with a 9.8% year-on-year increase, thanks to continued submarine and destroyer production.India is pressing ahead with its “Atmanirbhar Bharat” (self-reliant India) campaign in defense production. While not grabbing global headlines, its incremental gains highlight an emerging industrial base that could challenge traditional suppliers over time.“The combined arms revenues of the three Indian companies in the Top 100 increased by 8.2 per cent to $7.5 billion on the back of domestic orders,” the SIPRI report said.The picture in China couldn’t be more different. For the first time in years, China’s eight arms producers in the SIPRI Top 100-previously hailed as key enablers of President Xi Jinping’s military modernization push-lost major ground.The steepest fall came from NORINCO, China’s primary land systems manufacturer, which saw its revenue plunge 31% due to corruption scandals and leadership upheaval.CASC, China’s aerospace and missile systems leader, dropped 16% following delays in military satellite programs and the removal of its president amid graft allegations.Even AVIC, the country’s biggest defense company, slipped 1.3%, hampered by delays in aircraft deliveries.“A host of corruption allegations in Chinese arms procurement led to major arms contracts being postponed or cancelled in 2024,” said Nan Tian, director of the SIPRI military expenditure and arms production programme.China’s top-down, state-controlled defense sector may be big-but its opacity leaves it vulnerable to internal shocks. Political purges tied to Xi’s sweeping anti-corruption campaign disrupted procurement and leadership pipelines across several top defense firms.Only two of China’s eight arms producers recorded revenue growth-CSSC, the shipbuilding powerhouse, was one, rising 8.7%, aligned with China’s naval buildup in the South China Sea.India’s slow, state-driven growth might lack flash, but it also avoids the internal disarray seen in Beijing. Its procurement is transparent, aligned to strategic plans, and largely free of major political scandal.China, meanwhile, is still far ahead in sheer scale but vulnerable to top-level instability.While China dragged down the region’s total, other Asian powers picked up slack:South Korean arms producers rose 31% to $14.1 billion, driven by booming exports.Japan posted the largest jump in Asia: a 40% increase in arms revenues across five firms, reaching $13.3 billion, reflecting Tokyo’s shift toward proactive defense spending amid regional tensions.US firms remain the backbone of the global arms industry. The 39 American companies in the Top 100 generated $334 billion in arms revenues in 2024, a 3.8 per cent increase that leaves them with just under half of global Top 100 sales. Lockheed Martin alone booked $64.7 billion, while RTX, Northrop Grumman and General Dynamics each sat comfortably above $30 billion.Yet the American giant is struggling to turn money into timely capability. Programmes such as the F-35 fighter, the Columbia-class nuclear submarine and the Sentinel ICBM are all running late and over budget. Lockheed’s F-35 deliveries in 2024 were delayed by an average of 238 days per aircraft, and the programme’s projected sustainment costs have ballooned towards $1.6 trillion over its life. Northrop’s Sentinel programme has breached US cost-growth thresholds by around 80 per cent versus its original estimate.SIPRI’s Xiao Liang warns that “The delays and rising costs will inevitably impact US military planning and military spending… This could have knock-on effects on the US government’s efforts to cut excessive military spending and improve budget efficiency.” In plain terms, even as the US spends more, it risks getting less capability per dollar.European producers surged by 13%, reaching $151 billion, as countries rearm in response to Russia’s war in Ukraine.Russia’s corporate footprint in the SIPRI Top 100 remains surprisingly small—just two entities, Rostec and United Shipbuilding Corporation—but their combined arms revenues jumped 23 per cent in 2024 to an estimated $31.2 billion. Domestic demand linked to the Ukraine war more than offset shrinking exports. Russian plants have ramped up output of artillery shells, missiles and armoured vehicles; SIPRI cites reports of 1.3 million 152-mm shells produced in 2024, a more than fivefold increase over 2022.Where Russia is constrained, the Middle East is expanding. For the first time, nine companies from the region appear in the Top 100, with combined arms revenues of $31.0 billion, up 14 per cent where comparable data exist. Israeli firms alone generated $16.2 billion, a 16 per cent increase, fuelled both by the Gaza war and strong demand for uncrewed systems and missile defence worldwide.For India:Expect a continued push for domestic procurement and local manufacturing under the Defence Acquisition Procedure (DAP).India may look to expand exports, especially to Africa and Southeast Asia, but lacks the global competitiveness of Korean or Israeli systems.For China:Beijing still accounts for around 13 per cent of total Top 100 arms revenues, and its shipyards and missile producers have been central to the rapid expansion of the PLA Navy and rocket forces over the past decade.But the 2024 rankings hint at a temporary pause or re-ordering in its modernisation drive just as tensions over Taiwan and in the South China Sea remain high.Recovery will depend on restoring procurement integrity, managing talent loss, and containing political fallout.For Asia:The regional arms race is far from over.The pivot from importing to building continues—but success will depend on supply chain resilience, governance, and geopolitical alignment.India is climbing slowly, but surely-fueled by trust in institutions, steady demand, and political will.China, long considered an unstoppable defense juggernaut, now faces turbulence not from outside threats, but from within.In the evolving landscape of Asian defense, discipline may matter more than dominance. And for now, India is playing the long game.","India posted a quiet but steady 8.2% increase in combined revenues across its three Top 100 companies. Chinese arms revenues fell 10%, a setback tied to a wave of high-profile corruption scandals. Political purges tied to Xi’s sweeping anti-corruption campaign disrupted procurement and leadership pipelines across several top defense firms.","https://static.toiimg.com/thumb/msid-125697396,imgsize-1560408,width-400,resizemode-4/.jpg"
Govt orders handset makers to preload its Sanchar Saathi app,https://timesofindia.indiatimes.com/india/govt-orders-handset-makers-to-preload-its-sanchar-saathi-app/articleshow/125704436.cms,"(Representative image)

Political Storm Over Sanchar Saathi As Opposition Calls It A Snooping Tool, Govt Defends Move

Govt: Sanchar Saathi must be visible, fully functional on devices

NEW DELHI: In a move that is causing some concern to the industry and privacy advocates, govt has asked smartphone makers to mandatorily pre-install its Sanchar Saathi app on their devices. Govt says this is being done to strengthen cyber security on the devices and prevent tampering and spoofing of the IMEI (International Mobile Equipment Identity) number.The order, originally issued on Nov 21, gives device makers - including Apple, Samsung, Google, Motorola, and Chinese firms Xiaomi, Oppo and Vivo - 90 days to comply with the regulation or face penalties.Sanchar Saathi is pitched as a citizen-centric initiative of DoT that promises to ""empower mobile subscribers and strengthen their security"" while increasing awareness about govt initiatives.An order recently issued by govt to handset manufacturers states, ""Central govt hereby directs every manufacturer and importers of mobile handsets that are intended for use in India to... ensure that the Sanchar Saathi mobile application, as specified by DoT, is pre-installed on all mobile handsets manufactured or imported for use in India."" It also directs companies to ensure that the pre-installed app is ""readily visible and accessible to end users"" at the time of first use or device setup and that ""its functionalities are not disabled or restricted"".Nikhil Pahwa, founder of tech policy analysis company Medianama, said the order was ""bad news"" for mobile phone users and their privacy. ""Legally, one can argue that your mobile phone is your personal space, and this is an invasion of your personal space. It's where we have our most private conversations and exchange sensitive information with people we trust. How do we know this app isn't used to access files and messages on our device? Or a future update won't do that? This is clearly an invasion of our privacy. Remember how govt exempts itself from much of the Data Protection Law. This explains why,"" Pahwa said. The order is valid even for devices being imported into the country, or still in pre-sales transit.The direction has been given under Telecommunications (Telecom Cyber Security) Rules, 2024, and its further amendments.","Govt has asked smartphone makers to mandatorily pre-install its Sanchar Saathi app on their devices. Govt says this is being done to strengthen cyber security on the devices and prevent tampering and spoofing of the IMEI (International Mobile Equipment Identity) number. The order gives device makers - including Apple, Samsung, Google, Motorola, and Chinese firms Xiaomi, Oppo and Vivo - 90 days to comply with the regulation.","https://static.toiimg.com/thumb/msid-125704451,imgsize-696617,width-400,resizemode-4/representative-image.jpg"
Former Bangladesh PM Khaleda Zia reported to be in a critical condition; PM Modi offers assistance,https://timesofindia.indiatimes.com/india/former-bdesh-pm-zia-reported-to-be-in-a-critical-condition-pm-modi-offers-assistance/articleshow/125707351.cms,"Ousted PM Sheikh Hasina Faces Fresh Conviction as Court Awards 21-Year Term

With former Bangladesh PM Khaleda Zia reported to be in a very critical condition, PM Narendra Modi expressed concerns about her failing health and offered all possible assistance to her. Modi’s gesture is significant as Zia has had a troubled past with India in contrast to her rival Sheikh Hasina’s warm and friendly ties with India. Zia’s party BNP accused the Indian govt of undermining democracy in Bangladesh by backing an “authoritarian” Hasina who was deposed last year and forced to flee to India.“Deeply concerned to learn about the health of Begum Khaleda Zia, who has contributed to Bangladesh’s public life for many years. Our sincere prayers and best wishes for her speedy recovery. India stands ready to extend all possible support, in whatever way we can,” said Modi in a post on X.Significantly, a team of Chinese doctors, apparently sent by Beijing, arrived in Dhaka on Monday to help in Zia’s treatment.This is not the first time Modi has reached out to Zia and her party. He had a meeting with her during his visit to Dhaka in 2015 that govt described as “full spectrum outreach” on Bangladesh.Modi’s message will also be seen as an acknowledgement of the new reality in Bangladesh - and re-evaluation of India’s position - which goes to polls early next year and the possible return to power of BNP, which is expected to gain majorly from Hasina’s ouster. According to a local survey last week, as reported by Prothom Alo, there’s a tight race currently between the BNP and the Jamaat-e-Islami, with the BNP holding a slight three-point lead. India has on several occasions said in the recent past it seeks fair and inclusive polls in Bangladesh.With his outreach, Modi is also doubling down on India’s position that it remains committed to the best interest of Bangladesh, including peace, democracy, inclusion and stability in that country and will continue to engage with all stakeholders. BNP too has said it wants “balanced and respectful” ties with India.",Former Bangladesh PM Khaleda Zia reported to be in a very critical condition. PM Narendra Modi expressed concerns about her failing health and offered all possible assistance to her. Zia has had a troubled past with India in contrast to her rival Sheikh Hasina’s warm and friendly ties with India.,"https://static.toiimg.com/thumb/msid-125707360,imgsize-990556,width-400,resizemode-4/pm-modi-ani.jpg"
