Article Title,Article Link,Article Text,Article Summary,Article Image
Prime Minister’s Office new complex to be called 'Seva Teerth',https://timesofindia.indiatimes.com/india/prime-ministers-office-new-complex-to-be-called-seva-teerth/articleshow/125720910.cms,"NEW DELHI: Meant to reflect the spirit of service rather than ‘power’, the new complex housing the Prime Minister’s Office (PMO) shall be called ‘Seva Teerth’ (service pilgrimage), as per officials.Earlier called ‘Executive Enclave’ under the Central Visa Redevelopment project, Seva Teerth right now is in the final stages of completion. The Executive Enclave was meant to house the PMO, besides offices of the Cabinet secretariat, National Security Council Secretariat and India House, which will serve as a venue for high-level talks with visiting dignitaries.Seva Teerth shall be “a workplace designed to reflect the spirit of service and where national priorities take shape,” officials said and added that the choice of name is part of a quiet but profound shift taking place in the country’s public institutions.For instance, only last week, the home ministry wrote to the states and Union territories to rename governor’s houses as ‘Lok Bhavan’ or ‘Lok Niwas’ instead of ‘Raj Bhavan’ as the latter ‘smacks of colonialism’. Several states/UTs have already implemented the directive.Officials said the renaming of ‘Rajpath’ as ‘Kartavya Path’ and PM’s residence as 7, Lok Kalyan Marg instead of 7, Race Course Road, reflect the PM’s focus on changing the orientation of bureaucracy to ‘seva’ (service).The nomenclature ‘Lok Kalyan Marg’ conveys welfare, not exclusivity and is a reminder of the responsibility that lies ahead for every elected govt.“The idea of governance is moving from ‘satta’ (power) to ‘seva’ (service) and from authority to responsibility, they said, adding that the change is not just administrative, but cultural and moral,” said an officer.They added that the spaces of governance, under PM Modi, have been reshaped to lay stress on ‘kartavya’ (duty) and transparency.For instance, the Central Secretariat is now known as Kartavya Bhavan, a vast administrative hub built around the idea that public service is a commitment.“The change in nomenclature marks a deeper ideological transition and shift in mindset....Today, govt officials must speak the language of seva, kartavya and citizen-first governance,” said an officer.","The new complex housing the Prime Minister’s Office (PMO) shall be called ‘Seva Teerth’ (service pilgrimage), as per officials. The choice of name is part of a quiet but profound shift taking place in the country's public institutions.","https://static.toiimg.com/thumb/msid-125720978,imgsize-31176,width-400,resizemode-4/pm-modi.jpg"
India-Russia ties: Moscow ratifies key military pact ahead of Putin’s New Delhi visit - what is it?,https://timesofindia.indiatimes.com/india/india-russia-ties-moscow-ratifies-key-military-pact-with-india-ahead-of-putins-new-delhi-visit-what-is-it/articleshow/125720291.cms,"File photo: PM Narendra Modi with Russian President Vladimir Putin (Picture credit: PTI)



What is RELOS?

Access to facilities: Allows Russian military aircraft, vessels and personnel to use Indian bases and infrastructure — and enables Indian forces to do the same in Russia.

Allows Russian military aircraft, vessels and personnel to use Indian bases and infrastructure — and enables Indian forces to do the same in Russia. Support during operations: Provides logistics support for joint exercises, training missions, humanitarian work and disaster relief.

Provides logistics support for joint exercises, training missions, humanitarian work and disaster relief. Mutual use of airspace and ports: Authorises both sides to use each other’s airspace and ports, including warship visits, according to the Duma’s explanatory note.

Authorises both sides to use each other’s airspace and ports, including warship visits, according to the Duma’s explanatory note. Operational flexibility: Applies to any location where India and Russia agree to conduct operations together.

Applies to any location where India and Russia agree to conduct operations together. Efficiency in coordination: Intended to streamline cooperation during joint activities and emergency situations, enhancing military-to-military engagement.

NEW DELHI: Russia’s State Duma has formally approved a major military logistics pact with India just days before President Vladimir Putin lands in New Delhi for his December 4–5 state visit.The Reciprocal Exchange of Logistic Support (RELOS), which was signed on February 18, was tabled for ratification last week by Prime Minister Mikhail Mishustin.State Duma Speaker Vyacheslav Volodin said the move underlined the strength of the two countries’ partnership. He described the India–Russia relationship as “strategic and comprehensive” and said the pact’s ratification was another step towards deeper cooperation.According to details posted on the Duma’s website, the agreement will allow military aircraft, ships and other formations from both sides to use each other’s facilities for a range of activities, including joint exercises, training programmes, humanitarian operations and disaster-relief missions.These arrangements will apply wherever both governments agree to conduct operations, as per the news agency PTI.Putin’s visit includes the 23rd annual bilateral summit with Prime Minister Narendra Modi, where defence and trade deliverables are expected to feature prominently.Also read: Putin is coming to India in December 2025- Which other Russian presidents visited India, including Putin’s past trips Russian documents describe RELOS as a framework to simplify coordination during joint drills and emergency operations, with earlier Russian reports suggesting that it could also support activities in difficult regions such as the Arctic.Ahead of the visit, Kremlin spokesperson Dmitry Peskov said talks may include a possible additional S-400 missile system and discussions on the Su-57 fifth-generation fighter jet.He said the Su-57 is “the best plane in the world”, and noted Moscow’s readiness to broaden defence-technology ties, including through projects like BrahMos, reported news agency ANI.Russia has also signalled interest in strengthening civil-nuclear collaboration. Peskov said Moscow is prepared to offer India compact reactor technology and continues to support cooperation on projects like Kudankulam.Also read: Modi–Putin summit tests India's tightrope between Russia and the West RELOS (Reciprocal Exchange of Logistic Support) is a military logistics-sharing pact between India and Russia. It covers:",Russia’s State Duma has formally approved a major military logistics pact with India. President Vladimir Putin lands in New Delhi for his December 4–5 state visit. The Reciprocal Exchange of Logistic Support (RELOS) was signed on February 18.,"https://static.toiimg.com/thumb/msid-125720539,imgsize-832124,width-400,resizemode-4/untitled-design-99.jpg"
'Chor ki daadhi mein tinka': BJP defends Sanchar Saathi app; attacks Congress over privacy row,https://timesofindia.indiatimes.com/india/chor-ki-daadhi-mein-tinka-bjp-defends-sanchar-saathi-app-attacks-congress-over-privacy-row/articleshow/125720087.cms,"BJP MP and national spokesperson Sambit Patra (PTI)

Sanchar Saathi App Optional Says Centre Amid Fierce Pegasus-Like Snooping Charges and Privacy Debate

NEW DELHI: BJP on Tuesday hit back at the Congress after the opposition accused the government of infringing on citizens’ privacy by directing smartphone makers to preload the Sanchar Saathi app on new devices.Taking a jibe at the Congress, BJP MP and national spokesperson Sambit Patra said, “I know who will delete it… 'Chor ki daadhi mein tinka' (a guilty conscience needs no accuser)""He also made a veiled reference to the National Herald case, in which Congress leaders Sonia Gandhi and Rahul Gandhi are accused. “You know very well who they are. An FIR has also been filed against them. They have swindled Rs 5,000 crore. At present, they are out on bail,” he told reporters at the BJP headquarters, as reported by PTI.Defending the app, Patra said it is designed to protect users from fraud and crime, not to monitor them, and emphasised that people are free to remove it from their phones if they do not wish to use it.“The app cannot read your messages. It cannot listen to your calls, incoming or outgoing. Sanchar Saathi cannot reach or breach your personal data.” He added that the app helps provide security, check fraud, track stolen mobile phones, and return them to their owners.Minister of communications Jyotiraditya Scindia also,clarified that the app will remain dormant unless users register on it, and can be deleted at any time.Congress has alleged that the directive reflects a “dictatorial” approach, calling Sanchar Saathi a “snooping app” and demanding that the move be withdrawn. Congress president Mallikarjun Kharge accused the government of trying to “strangulate the voice of the people”.Responding sharply, Patra said, ""Mr Kharge, it is not meant to strangulate people's voice but to secure their voice, and their mobile phones, without which life is difficult today. We need to secure the device. That is why the government has brought this app.”“You keep on spreading misinformation. But people know how to move on,” he added, as quoted by PTI.","BJP hit back at the Congress after the opposition accused the government of infringing on citizens’ privacy. Congress has alleged that the directive reflects a “dictatorial” approach, calling Sanchar Saathi a ‘snooping app’ BJP MP and national spokesperson Sambit Patra said it is designed to protect users from fraud and crime.","https://static.toiimg.com/thumb/msid-125720106,imgsize-887148,width-400,resizemode-4/pic-47.jpg"
​Evening newswrap: Lok Sabha to hold 10-hour debate on electoral reforms; Imran Khan's sister meets jailed leader; & more,https://timesofindia.indiatimes.com/india/evening-newswrap-lok-sabha-to-hold-10-hour-debate-on-electoral-reforms-imran-khans-sister-meets-jailed-leader-more/articleshow/125718747.cms,"Eveving newswrap

Pakistan On Boil As Imran Khan Supporters Defy Crackdown Amid Rumours Of Death And Deep Isolation

Here are the top 5 news stories of the day:

Lok Sabha to hold 10-hour debate on electoral reforms after breakthrough with opposition



Pakistani authorities allow Imran Khan’s sister to meet him after weeks of restricted access



Telecom minister clarifies Sanchar Saathi App is optional, not mandatory



Rahul Gandhi comments on the stray dog incident in Parliament, BJP hits back



'Forced Pak ships to stay in ports': Navy chief highlights role in Operation Sindoor



NEW DELHI: Parliament is set to hold key discussions on electoral reforms and the 150th anniversary of the national song, Vande Mataram , after lawmakers reached an agreement to resume proceedings smoothly following days of disruptions.Meanwhile, in Pakistan, former Prime Minister Imran Khan received a visit from his sister at Adiala Jail, breaking weeks of restricted access that had sparked protests by PTI supporters and family members.Navy chief Admiral Dinesh K Tripathi announced the upcoming commissioning of the country’s third indigenous nuclear submarine and highlighted the Navy’s strategic role during Operation Sindoor , which pressured Pakistan’s naval forces to remain close to their ports.The government and opposition reached an agreement to ensure smooth functioning of Parliament after two days of disruptions, clearing the way for a detailed 10-hour discussion on electoral reforms on December 9 and 10. The decision was finalised during a Business Advisory Committee meeting chaired by Speaker Om Birla, who also scheduled a debate on the 150th anniversary of Vande Mataram for December 8. Read full story Authorities at Rawalpindi’s Adiala Jail allowed Imran Khan’s sister, Uzma Khanum, to meet the former Pakistan prime minister after several weeks of denied access that had fuelled protests by PTI supporters.PTI workers gathered outside the jail as family members demanded clarity on Imran’s health. The meeting followed weeks of blocked visits despite an Islamabad High Court order and growing tensions over alleged police assaults on Imran’s sisters during recent demonstrations. Read full story Telecom minister Jyotiraditya Scindia clarified that the government’s Sanchar Saathi cybersecurity app is completely optional for users. Speaking outside Parliament, he said the app does not enable call monitoring or snooping, and users can choose to register, remain inactive, or delete it at any time. Read full story Congress leader Rahul Gandhi weighed in on the controversy surrounding MP Renuka Chowdhury bringing a stray dog to Parliament, questioning why pets are allowed “inside” but not outside the complex. He said, “What has the poor dog done? I guess these are the things India is discussing these days,” as per PTI. The remarks drew criticism from the BJP, which accused Gandhi of likening leaders to dogs. Read full story Navy chief Admiral Dinesh K Tripathi announced that India’s third indigenously built nuclear-powered submarine will be commissioned soon. Speaking ahead of Navy Day, he said the Navy’s swift and aggressive action during counterterror Operation Sindoor forced Pakistan’s naval forces to stay close to their ports near the Makran coast. Read full story","Lok Sabha to hold 10-hour debate on electoral reforms after breakthrough with opposition. Pakistan authorities allow Imran Khan’s sister to meet him after weeks of restricted access. Telecom minister clarifies Sanchar Saathi App is optional, not mandatory.","https://static.toiimg.com/thumb/msid-125719047,imgsize-1039755,width-400,resizemode-4/untitled-design-98.jpg"
"‘Space teaches you to adapt’: Group Captain Shubhanshu Shukla on what the ISS got right, what India can learn, and more",https://timesofindia.indiatimes.com/india/space-teaches-you-to-adapt-group-captain-shubhanshu-shukla-on-what-the-iss-got-right-what-india-can-learn-and-more/articleshow/125718779.cms,"Shux utilizes a microscope to conduct research in the Destiny Lab on ISS. Pic Credit-Nasa

Capt Shubhanshu Shares What India Can Learn from ISS Successes

When you look back at your time on the ISS, what moment best captured what the station was meant to achieve?

Did working with an international crew change your view of what India should prioritise as it builds its own human-spaceflight capability?

Shux with Axiom-4 and other ISS crew – pic credit Axiom Space

From an astronaut’s perspective, what did the ISS get right in long-duration life support and crew operations—and where did it fall short?

As the ISS nears retirement, what key lessons should India apply when planning future partnerships?

Shux looks out towards Earth from the Cupola module on ISS – pic credit: Shubhanshu Shukla–ISRO

As India plans a long-term presence in low-Earth orbit, what design or mission principles from the ISS would you keep, revise, or discard?

Group Captain Shubhanshu Shukla ’s (Shux) 20-day mission to the International Space Station earlier this year gave India a rare, first-hand view into how the world’s most complex engineering project functions on an ordinary day—and how it copes when things are not ordinary at all. As India prepares for a sustained human presence in low-Earth orbit through the Bharatiya Antariksh Station, Shukla’s reflections offer a grounded account of what the ISS achieved, where it stumbled, and how India should shape its own long-term strategy.In this exclusive interview to TOI, Shux speaks about the moments that defined his time on the station, the value of international collaboration, and the design philosophy that India could adopt for missions in the coming decades.The International Space Station remains one of humanity’s most dazzling examples of what happens when engineering ambition meets international cooperation, and miraculously, everyone agrees on the same orbit. Conceived in an era when floppy disks were still in fashion and the internet sounded like a dial-up flute, the ISS was built to push the boundaries of science in microgravity, test systems essential for future deep-space missions, and serve as a beacon of peaceful collaboration between nations that otherwise rarely agree on anything terrestrial.Construction of this orbital leviathan began in 1998 and reached completion in 2011. To assemble it, humanity performed a kind of celestial Lego project that required more than 1,000 hours of spacewalks and more than 40 Space Shuttle flights. The result? The largest continuously inhabited laboratory off the planet, a structure the size of a football field hurtling around Earth at 28,000 km/h, completing a lap every 90 minutes.During my own mission aboard the ISS, the station felt exactly like the global village it was designed to be. We had 11 crew members representing six nationalities, a small floating model of the United Nations , minus the speeches and with better views. Over the course of our 20-day stay, we conducted more than 60 scientific experiments spanning biology, materials science, human physiology, and space technology. We also carried out STEM demonstrations that connected us with students across the world, sparking curiosity, answering wide-eyed questions, and hopefully inspiring the next generation of explorers, engineers, and dreamers.Looking back, those 20 days perfectly captured the essence of what the ISS set out to achieve. For a machine conceived with 1990s technology, when the most futuristic thing on Earth was a Nokia phone, to not only remain relevant but to continue fulfilling and expanding its mission objectives is extraordinary. The station does not just orbit Earth; it orbits the idea that cooperation, curiosity, and courage can build something remarkable, even 400 kilometres above our heads.Working with crew members from different nationalities reaffirmed something fundamental about space exploration: at its core, it is a profoundly collaborative human endeavour. Space does not care about passports, accents, or geopolitical boundaries. Up there, the only border you notice is the thin blue line of Earth’s atmosphere.During my training for this mission, I found myself hopping across continents more frequently than airline safety videos. From the meticulous engineers in Japan, to the precision-driven teams in Europe, to the seasoned experts in the United States, and the ever-innovative minds in India, each group brought its own culture, expertise, and philosophy to the table. It was like assembling a global orchestra where every instrument mattered, and the symphony was a successful human spaceflight.Before this mission, I knew conceptually that space operations required international coordination. But seeing it firsthand—the late-night calls across time zones, the joint simulations, the integrated training programmes, and the sheer number of people quietly working behind the scenes—made me appreciate the astonishing complexity of sending even one human to space. A single crewed mission represents thousands of hours of planning, countless technical discussions, and the collective will of teams who might never meet but still trust one another implicitly.Beyond accomplishing scientific and operational goals, this collaboration builds something equally important: relationships and trust among people from vastly different cultures and backgrounds. In space, camaraderie is not optional; it is oxygen for the mission. You quickly learn that no matter where someone comes from, if they work in human spaceflight, they speak a common language: space.As we continue advancing on our journey in human space exploration, it is vital that we hold on to this foundational principle. The power of collaboration is not just a sentiment; it is the engine that drives progress. Space has always transcended boundaries, and the work we do should honour that spirit. The only way humanity will reach farther into the cosmos is by going there together.The first module of the International Space Station, the Russian-built Zarya, appropriately named “Dawn”, launched in 1998, marking the beginning of humanity’s most ambitious construction project not on Earth. Over the next 13 years, we assembled this orbital behemoth piece by piece, like a cosmic IKEA kit, except the manual was 10,000 pages long and required spacewalks instead of Allen keys.One of the ISS’s greatest design triumphs was its modular architecture. This was not just clever; it was visionary. The modular approach meant components, scientific racks, power systems, and entire habitable modules could be added, upgraded, or even replaced long after launch. Several of the station’s capabilities today, from advanced biology labs to new solar arrays, were not on the drawing board in the 1990s. Yet the structure welcomed them gracefully, proving its resilience.Another stroke of genius was the strict standardisation of interfaces and protocols. Despite contributions from different space agencies—Nasa, Roscosmos, ESA, JAXA, and CSA—each with its own engineering philosophy, the requirement was simple: any module joining the ISS had to integrate seamlessly with the command-and-control backbone. This ensured that a Japanese experiment rack, a European robotic arm, and an American airlock could all operate in harmony.Equally important was the flexibility for on-orbit maintenance and upgrades. Astronauts often replaced hardware, rerouted cables, installed new instruments, and even deployed new solar arrays. When you build for decades of use, you cannot predict every challenge, so the ISS needed enough adaptability to absorb surprises.That said, the ISS was not designed to be fully future-proof. Technology has moved fast in the last two decades, and modern ISS interiors sometimes look like an enthusiastic octopus let loose with a box of cables. It is high-functioning chaos.As we look ahead, this is the lesson we must carry forward: whatever we design today must be able to absorb the technology of tomorrow.As the ISS approaches its well-earned retirement after more than two decades in orbit, it leaves behind a legacy and a treasure trove of lessons. My time aboard crystallised one truth: before building a space station, you must begin with a sharply defined question—what is it for?Is it a research laboratory? A technology testbed? A stepping stone to the Moon? A commercial outpost? A training ground? The purpose shapes everything that follows.The ISS has also shown the power of collaboration. At a time when nations often disagree on Earth, the station has remained a counterexample, an engineering handshake orbiting above geopolitics. It is still the only structure where multiple countries can send astronauts, run experiments, and access an environment otherwise out of reach. India has been a proud beneficiary of this openness.But the ISS also teaches caution: mismatched priorities, slow adaptation to emerging technologies, and design decisions frozen in the 1990s reveal pitfalls to avoid.Going forward, the challenge is to distil the ISS story into a blueprint for the next chapter of human presence in space. Embedded in its cables and maintenance logs are lessons on what must be done, what must never be done again, and what must be done better. The ISS is not merely retiring; it is passing the torch.The philosophy of modularity has been one of the ISS’s greatest gifts to space engineering. In microgravity, “weight” loses its meaning, and you can launch components separately, even years apart, and assemble them like an orbital jigsaw. But modularity works only if you treat construction as a long-term strategy, a roadmap spanning decades.Flexibility is the other key lesson. Space teaches you quickly that no plan survives first contact with reality. The ISS construction phase was a masterclass in adapting to hardware mismatches, alignment quirks, and surprises delivered by orbital mechanics. The design must have elasticity to absorb new insights and evolving technologies.A station is not just modules; it is an ecosystem. The Earth-based infrastructure—mission control, simulators, life-support testbeds, logistics chains—matters as much as the hardware in orbit. Astronauts need operational flexibility too. They become builders, plumbers, electricians, scientists, and troubleshooters.Design follows objectives. Before drawing the first bolt pattern or finalising an airlock diameter, the mission’s purpose must be clear.As India prepares for the Bharatiya Antariksh Station, we are at a pivotal moment. The insights from decades of ISS operations—its triumphs, surprises, and even its cluttered cable aesthetics—are guiding our approach. We now have the opportunity to design a next-generation station informed by a quarter-century of real orbital experience.","Group Captain Shubhanshu Shukla’s 20-day mission to the International Space Station earlier this year gave India a rare, first-hand view into how the world's most complex engineering project functions. As India prepares for a sustained human presence in low-Earth orbit through the Bharatiya Antariksh Station, Shux offers a grounded account of what the ISS achieved, where it stumbled, and how India should shape its own strategy.","https://static.toiimg.com/thumb/msid-125718805,imgsize-709754,width-400,resizemode-4/.jpg"
