Article Title,Article Link,Article Text,Article Summary,Article Image
"Wordle today #1625: Hints and answers for today’s Wordle (November 30, 2025)",https://timesofindia.indiatimes.com/technology/gaming/wordle-today-1625-hints-and-answers-for-todays-wordle-november-30-2025/articleshow/125668451.cms,"Why Wordle is the ultimate game for word lovers



Decode the challenge: Smart strategies to solve Wordle in six moves



Objective: Identify the secret five-letter word in six attempts.

First move: Begin with a word that includes common vowels and consonants to uncover key letters early.

Enter a guess: Type any valid five-letter word and submit it.

Review clues: Green indicates the correct letter in the right position, yellow shows the correct letter in the wrong position, and grey means the letter is not in the word.

Strategy tip: Use the feedback from each guess to narrow down possible words.

Avoid mistakes: Exclude letters that have already been ruled out.

Final goal: Solve the word within six guesses before your attempts run out.

Wordle hints and clues for today’s puzzle



Starting letter: Today’s Wordle answer begins with “M”.

Final hint: It is something you feel during a summer day.

Vowels: The answer contains one vowel.

Double letters: Yes, one double letter appears in today’s Wordle.

What is today’s Wordle answer?



MUGGY

Meaning of Muggy





The New York Times’ Wordle continues to engage word lovers around the world. Puzzle #1625 challenges players to guess a secret five-letter word within six attempts, testing their vocabulary, logic, and deduction skills. This guide offers helpful hints, a step-by-step solving strategy, and the final answer for Wordle #1625, perfect for anyone looking for a little extra support. Each clue is crafted to improve your guessing strategy, enhance pattern recognition, and strengthen problem-solving skills. Whether you’re a casual player or a devoted Wordle fan, this guide makes the puzzle more enjoyable, insightful, and rewarding. Get ready to sharpen your mind and embrace the thrill of today’s challenge.Wordle is a daily word game that challenges players to uncover a hidden five-letter word in six tries. After each guess, colour-coded tiles provide feedback: green means the letter is correct and in the right position, yellow shows the letter is in the word but in the wrong spot, and grey indicates letters that aren’t in the word. Its simple yet addictive gameplay has earned worldwide popularity.Wordle helps improve vocabulary, pattern recognition, and strategic thinking. With a new puzzle released every day, it has become a favourite daily ritual for word lovers across the globe.Having trouble with today’s Wordle? These 4 hints, covering starting letters and vowels, will guide you straight to the solution.Correctly guessing the vowels can help you identify the five-letter word faster.The Wordle answer for #1625 on November 30, 2025, is: Weather that feels unpleasantly warm, heavy, and humid.","The New York Times’ Wordle continues to engage word lovers around the world. Puzzle #1625 challenges players to guess a secret five-letter word within six attempts, testing their vocabulary, logic, and deduction skills. This guide offers helpful hints, a step-by-step solving strategy, and the final answer.","https://static.toiimg.com/thumb/msid-125668452,imgsize-15890,width-400,resizemode-4/wordle-today-1625-hints-and-answers-for-todays-wordle-november-30-2025.jpg"
"Nvidia CEO Jensen Huang to employees at town hall: Market not happy with our results, did you check memes on the internet",https://timesofindia.indiatimes.com/technology/tech-news/nvidia-ceo-jensen-huang-to-employees-at-town-hall-market-not-happy-with-our-results-did-you-check-memes-on-the-internet/articleshow/125482639.cms,"Nvidia’s quarterly results







Nvidia CEO Jensen Huang recently struck a humorous and candid tone in the company’s recent Townhall with the employees. Huang acknowledged that despite delivering a record-shattering earnings, the market reaction was less enthusiastic. As reported by Business Insider, Huang said that Nvidia’s influence has created a no-win situation with expectations so hight that even minor missteps could shake global markets. Huang also talked about the online chatter and memes about the company’s economic role. “If we delivered a bad quarter, if we’re off by just a hair, if it just looked a little bit creaky, the whole world would’ve fallen apart. You should’ve seen some of the memes on the internet. We’re basically holding the planet together — and it’s not untrue.”Nvidia reported a record quarter with $57 billion revenue which is up by 62% year-over-year, and forecasted $65 billion for the fourth quarter. The shares of the company rose by 5% in after-hours trading. Nvidia CFO Colette Kress reinforced the bullish outlook, noting, “The clouds are sold out. Our GPU installed base is fully utilized.”Nvidia’s blockbuster quarterly results rebuffs the growing narratives of an AI bubble.“If we delivered a bad quarter, it is evidence there’s an AI bubble. If we delivered a great quarter, we are fueling the AI bubble,” Huang told employees, according to a Business Insider report.Along with this, Huang also said that he was ‘delighted’ with the company’s results and proud of employees. He further added that Nvidia’s massive influence has made expectations harder to meet a reality reflected in its volatile market value.Huang lightheartedly recalled the “good old days” when Nvidia’s market cap stood at $5 trillion, joking about the company’s recent valuation swings, “Nobody in history has ever lost $500 billion in a few weeks. You’ve gotta be worth a lot to lose $500 billion in a few weeks.”","N Nvidia CEO Jensen Huang recently struck a humorous and candid tone in the company’s recent Townhall with the employees. Huang acknowledged that despite delivering a record-shattering earnings, the market reaction was less enthusiastic. Huang also talked about the online chatter and memes about the company's economic role. “If we delivered a great quarter, we are fueling the AI bubble,” Huang told employees.","https://static.toiimg.com/thumb/msid-125482626,imgsize-82050,width-400,resizemode-4/nvidia-ceo-jensen-huang.jpg"
Twitter’s advertising boss once seen as successor to former CEO Linda Yaccarino leaves Elon Musk’s company,https://timesofindia.indiatimes.com/technology/tech-news/twitters-advertising-boss-once-seen-as-successor-to-former-ceo-linda-yaccarino-leaves-elon-musks-company/articleshow/124805672.cms,"X witnessing executive exodus amid strategic churn



Mahmoud Reza Banki, X’s Chief Financial Officer, who announced his departure in early October after less than a year.

Mike Liberatore, xAI’s Chief Financial Officer, who quit over the summer.

Robert Keele, xAI’s General Counsel, who also left shortly after Liberatore.

‘Musk’s demands to increase sales pushed resignations’







John Nitti, the global head of revenue operations and advertising innovation at X (formerly Twitter ), has departed the social media platform after only 10 months. His exit marks the latest senior-level departure from Elon Musk ’s executive ranks and comes just months after he was viewed by industry insiders as a potential successor to former CEO Linda Yaccarino, a report has said.Nitti, a former Verizon executive, left X on Friday (October 24), The Financial Times reported citing people familiar with the matter. His departure follows Yaccarino’s resignation in July, after which her duties were divided among several leaders, including Nitti.Nitti’s exit reflects an ongoing wave of senior executive departures since Musk’s AI startup, xAI, took over the social media platform in March. The resignations have reportedly been attributed to frustration over Musk’s sudden strategy changes and the difficulty of executing objectives under his management style.Other recent high-profile departures include:It is also being reported that there has been a constant pressure to boost revenues, which, combined with Musk’s simultaneous spending of billions on infrastructure for the AI race, fueled the resignations.The report said that advertising executives like Nitti have faced intense demands from Musk to increase sales, even as many advertisers have pulled back. Brands were deterred by Musk’s decision to relax content moderation standards based on his ""free speech"" ideals.The report cites sources as saying that Nitti was among sales leaders who grew frustrated with Musk’s management of the advertising business. Following the CEO’s disengagement from the Trump administration this past summer, Musk began making more unilateral decisions around advertising without consulting his leadership team.While xAI has recently secured new media partnerships, including one with Disney, and claims improving advertising metrics due to its AI technology, some advertisers privately complain they felt pressured to spend after X sued several brands for allegedly undertaking an ""illegal boycott.""","John Nitti, the global head of revenue operations and advertising innovation at X (formerly Twitter ), has departed the social media platform after only 10 months. His exit marks the latest senior-level departure from Elon Musk ’s executive ranks and comes just months after he was viewed as a potential successor to former CEO Linda Yaccarino.","https://static.toiimg.com/thumb/msid-124805693,imgsize-7992,width-400,resizemode-4/x-twitter.jpg"
Microsoft confirms it is working on free version of Xbox Cloud Gaming,https://timesofindia.indiatimes.com/technology/tech-news/microsoft-confirms-it-is-working-on-free-version-of-xbox-cloud-gaming/articleshow/124805857.cms,"Xbox

How the free tier of Xbox Cloud Gaming may work



Games they already own.

Eligible Free Play Days titles (games typically offered for a free weekend trial).

Xbox Retro Classics games.

Xbox’s higher sales targets







Microsoft has confirmed that it is internally testing an ad-supported, free version of Xbox Cloud Gaming, which will allow users to stream select titles without requiring a paid Game Pass subscription. The company has officially confirmed this tier is going to be a separate tier from the existing game pass subscription, according to a report by The New York Times.The initiative aims to significantly broaden access to Xbox Cloud Gaming, which has previously been bundled exclusively with the Game Pass subscription.Earlier this month, a report by The Verge claimed that the software giant has already begun testing the free tier among employees. The ad-supported service is expected to provide users with access to:The company is reportedly testing a model where users will view approximately two minutes of pre-roll advertisements before a game starts streaming. Internal testing also features limits on playtime, including a one-hour session limit and a maximum of five hours of free streaming per month. These restrictions are subject to change before the official launch, the report noted.The free tier is expected to be widely available across PC, Xbox consoles, handheld devices and web browsers. The report also said that a public beta test is expected soon, with a full launch expected in the coming months.Recently, a report suggested that Microsoft has demanded much higher profits from its Xbox gaming division than what's typical in the video game industry. Bloomberg claimed that the tech giant has told the Xbox unit that it must achieve 30% “accountability margins” – Microsoft's term for profit margins – across all its gaming operations.Citing financial research firm S&P Global Market Intelligence, the publication says that the average profit margin in the video game industry typically ranges between 17% and 22%. This change reportedly came after Microsoft CFO Amy Hood implemented the new 30% target.","Microsoft has confirmed that it is internally testing an ad-supported, free version of Xbox Cloud Gaming. The free tier will allow users to stream select titles without requiring a paid Game Pass subscription. The company is reportedly testing a model where users will view approximately two minutes of pre-roll advertisements before a game starts streaming. Internal testing also features limits on playtime, including a one-hour session limit.","https://static.toiimg.com/thumb/msid-124805830,imgsize-1619362,width-400,resizemode-4/xbox-cloud.jpg"
NYT Connections today’s hints and answers (#903) for 30 November 2025,https://timesofindia.indiatimes.com/technology/gaming/nyt-connections-todays-hints-and-answers-903-for-30-november-2025/articleshow/125668567.cms,"What is NYT Connections





NYT Connections: Hints for today’s puzzle



Yellow category hint – Endure

Green category hint – Failure

Blue category hint – Pirates

Purple category hint – Words that sound like colors at the end

NYT Connections today ’s categories

Yellow – TOLERATE

Green – FLOP

Blue – FICTIONAL PIRATES

Purple – ENDING IN COLOR HOMOPHONES

NYT Connections answers for November 30, 2025



TOLERATE: BEAR, STAND, STOMACH, SWALLOW

FLOP: BUST, LEMON, MISS, TURKEY

FICTIONAL PIRATES: HOOK, LUFFY, SILVER, SPARROW

ENDING IN COLOR HOMOPHONES: CAMEROON, COCKATIEL, UNREAD, WHISTLEBLEW

NYT Connections related FAQs



How do I play the game?

Are hints available?

Can I play NYT Connections for free?

What skills does the game improve?





The New York Times’ Connections has quickly become a favourite among word puzzle enthusiasts, blending the addictive simplicity of Wordle with more complex challenges in logic and pattern recognition. Each day, players face 16 seemingly random words arranged in a 4x4 grid, tasked with sorting them into four distinct thematic groups. Success depends on identifying subtle connections, associations, and clever wordplay, making the game both fun and mentally stimulating. For puzzle lovers looking to test their skills, the November 30, 2025 edition (game #903) offers an ideal mix of challenge and insight, encouraging lateral thinking, careful observation, and strategic reasoning. Connections continues to captivate a global audience as a daily exercise in cognitive skill and mental agility.NYT Connections is a captivating word association game designed to test analytical thinking, lateral reasoning, and cognitive flexibility. Unlike standard word games, players must detect subtle links between words, which can range from obvious to highly nuanced or abstract. The game is freely available on mobile devices and desktop platforms, allowing enthusiasts to play anytime, anywhere, at their convenience.Its combination of easy-to-understand mechanics, challenging puzzles, and complex problem-solving has turned it into a daily ritual for many. The game’s structure encourages players to sharpen their pattern recognition, develop strategic thinking, improve memory retention, and enjoy a mental workout while having fun.To assist players without giving away the answers directly, here are strategic hints for November 30, 2025:These hints guide players toward recognising patterns, encouraging logical deduction and strategic grouping without removing the challenge entirely.For game #903, the four categories are specifically:Success in the game depends on carefully observing wordplay, spotting subtle connections, and applying strategic reasoning to find the correct groupingsFor those ready to review their solutions or learn from the puzzle logic, the complete answers for game #903 are:Connections continues to captivate players worldwide, turning each puzzle into a thrilling hunt for hidden patterns, where every correct grouping sparks a moment of “aha!” and keeps the mind sharp for the next challenge.Words are presented in a 4x4 grid. Identify patterns or associations to sort them into four correct categories.Yes, the game provides subtle hints to guide players without revealing the answers outright.Yes, it is available for free on both mobile devices and desktop platforms.It sharpens pattern recognition, logical thinking, lateral reasoning, and problem-solving skills.","NYT Connections is a captivating word association game designed to test analytical thinking, lateral reasoning, and cognitive flexibility. Each day, players face 16 seemingly random words arranged in a 4x4 grid, tasked with sorting them into four distinct thematic groups. Success depends on identifying subtle connections, associations, and clever wordplay.","https://static.toiimg.com/thumb/msid-125668603,imgsize-10546,width-400,resizemode-4/nyt-connections-todays-hints-and-answers-903-for-30-november-2025.jpg"
Google founder Larry Page beats Jeff Bezos to become world’s third richest person and how latest Gemini AI model is behind this,https://timesofindia.indiatimes.com/technology/tech-news/google-founder-larry-page-beats-amazon-founder-jeff-bezos-to-become-worlds-third-richest-person-and-how-latest-gemini-ai-model-is-behind-this/articleshow/125482055.cms,"Google co-founder Larry Page has become the world's third-richest person, surpassing Jeff Bezos as Alphabet's shares surged following the Gemini 3 AI model launch. Page's net worth increased significantly, placing him behind Elon Musk and Larry Ellison. The article highlights AI's impact on billionaire rankings, noting Oracle's recent stock volatility.","Google co-founder Larry Page has become the world's third-richest person, surpassing Jeff Bezos. Page's net worth increased significantly, placing him behind Elon Musk and Larry Ellison. The article highlights AI's impact on billionaire rankings, noting Oracle's recent stock volatility.","https://static.toiimg.com/thumb/msid-125482230,imgsize-722396,width-400,resizemode-4/google-founder-larry-page-beats-amazon-founder-jeff-bezos-to-become-worlds-third-richest-person-and-how-latest-gemini-ai-model-is-behind-this.jpg"
JP Morgan is very angry as America's largest bank has to pay legal fee of the 32-year-old startup CEO charged of defrauding it of $175 million; calls it ...,https://timesofindia.indiatimes.com/technology/tech-news/jp-morgan-chase-is-very-angry-as-it-has-to-pay-legal-fee-of-the-32-year-old-startup-ceo-charged-of-defrauding-americas-largest-bank-of-175-million-calls-it-/articleshow/124807636.cms,"US Chaos: Leavitt’s Shutdown Warning Comes True; Tech Meltdown Grounds Alaska Airlines Flights

Charlie Javice vs JP Morgan case





JPMorgan Chase is reportedly quite annoyed. Reason: The America's largest bank wants a way out of paying for Charlie Javice's legal bills. This despite the fact that 32-year-old founder of fintech company Frank, Charlie Javice, has been found guilty of defrauding JPMorgan Chase of $175 million. As a clause in JPMorgan's contract with Javice, tied to the original sale of her startup, Frank, has kept the bank liable for her legal fees.In a Friday court filing, JPMorgan requested an end to its obligation to fund Javice’s legal defense as she appeals her guilty verdict before beginning a seven-year prison sentence. The bank described the legal fees as “patently excessive and egregious,” with $60.1 million already advanced to Javice for her criminal defense. The filing further reads that Javice has ""unreasonably"" hired five law companies, including one that received $35.6 million, calling the arrangement “overlapping, duplicative, and excessive. ”Pablo Rodriguez, a JPMorgan spokesperson, told Business Insider, “The legal fees sought by Charlie Javice and Olivier Amar are an abuse, and we look forward to sharing details with the court in coming weeks.” The bank’s lawyers argued that without court intervention, JPMorgan faces “irreparable injury” from what they described as Javice’s legal team treating the fee arrangement as a “blank check.”Javice’shigh-profile defense team includes Alex Spiro of Quinn Emanuel, known for representing clients like Elon Musk and Kim Kardashian, with an hourly rate reportedly reaching $3,000.In March, a federal jury in Manhattan has found Charlie Javice guilty of defrauding JPMorgan Chase. Prosecutors said that she tricked JPMorgan into believing her fintech had data for over 4 million students. JPMorgan’s move comes as the bank seeks to limit its financial exposure tied to the controversial acquisition of Frank, which prosecutors say was inflated by fraudulent misrepresentations.Javice was 27 years old in summer 2021, when JPMorgan executives agreed to acquire her website.","Charlie Javice, founder of fintech company Frank, found guilty of defrauding JPMorgan Chase of $175 million. As a clause in JPMorgan's contract, tied to the original sale of her startup, Frank, has kept the bank liable for her legal fees. In a Friday court filing, JPMorgan requested an end to its obligation to fund Javice’s legal defense as she appeals her guilty verdict.","https://static.toiimg.com/thumb/msid-124807627,imgsize-87978,width-400,resizemode-4/jp-morgan.jpg"
Google CEO Sundar Pichai celebrates new breakthrough in quantum algorithm; Elon Musk replies: ‘Looks like…’,https://timesofindia.indiatimes.com/technology/tech-news/google-ceo-sundar-pichai-celebrates-new-breakthrough-in-quantum-algorithm-elon-musk-replies-looks-like/articleshow/124754841.cms,"



What Sundar Pichai wrote in the post

“New breakthrough quantum algorithm published in @Nature today: Our Willow chip has achieved the first-ever verifiable quantum advantage.

Willow ran the algorithm - which we’ve named Quantum Echoes - 13,000x faster than the best classical algorithm on one of the world's fastest supercomputers. This new algorithm can explain interactions between atoms in a molecule using nuclear magnetic resonance, paving a path towards potential future uses in drug discovery and materials science.

And the result is verifiable, meaning its outcome can be repeated by other quantum computers or confirmed by experiments.

This breakthrough is a significant step toward the first real-world application of quantum computing, and we're excited to see where it leads.”

Why Google’s Willow chip experiment matters

Google To Invest $15 Billion On AI Hub In Visakhapatnam, CEO Sundar Pichai Speaks To PM Modi





Google CEO Sundar Pichai recently shared a post on X, formerly Twitter, announcing a new breakthrough in quantum algorithms. “Our Willow chip has achieved the first-ever verifiable quantum advantage,” Pichai wrote in the post, adding it is “13,000x faster than the best classical algorithm on one of the world's fastest supercomputers”. Pichai’s post caught the attention of Tesla CEO Elon Musk . The tech billionaire replied to Pichai’s post saying “Congrats. Looks like quantum computing is becoming relevant.”Announcing the major breakthrough, Google CEO Sundar Pichai wrote:The achievement marks a historic breakthrough in quantum computing. For the first time ever, a quantum computer has performed a complex, verifiable calculation faster than any supercomputer could — about 13,000 times faster. This moment is being called a “verifiable quantum advantage.""Using Google’s Willow quantum chip, researchers ran an advanced algorithm called Quantum Echoes (or OTOC — out-of-order time correlator).This algorithm helps scientists study how information spreads in quantum systems — things like molecules, magnets, or even black holes.The key part: the result was verifiable and repeatable, meaning other quantum computers could confirm it independently.","Google CEO Sundar Pichai recently shared a post on X, formerly Twitter, announcing a new breakthrough in quantum algorithms. Using Google’s Willow quantum chip, researchers ran an advanced algorithm called Quantum Echoes. This algorithm helps scientists study how information spreads in quantum systems like molecules, magnets, or even black holes.","https://static.toiimg.com/thumb/msid-124754832,imgsize-19166,width-400,resizemode-4/google-ceo-sundar-pichai.jpg"
