Article Title,Article Link,Article Text,Article Summary,Article Image
Shopify restores services after Cyber Monday outage hits merchant,https://timesofindia.indiatimes.com/technology/tech-news/shopify-restores-services-after-cyber-monday-outage-hits-merchant/articleshow/125708462.cms,"Shopify outage : Here’s what the company said



Impact on merchants due to Shopify outage







Shopify, the e-commerce major faced a widespread outage on Cyber Monday (December 1). Due to the major outage thousands of merchants were not able to process orders during the peak holiday traffic. Shopify also confirmed the outage and said that the issue has now been resolved and the company is now working on restoring services. As per Shopify’s official status page, the outage started around Monday afternoon and it affected the core services such as checkout, storefronts and admin dashboards. The Merchants also reported being unable to complete the transactions to access backend tools, effectively halting business during one of the most busiest shopping days of the year.Shopify acknowledged the disruption and it also provided regular updates via its status portal. By late evening, the company confirmed that all systems had been restored. In a statement, Shopify said engineers had identified and fixed the underlying issue, ensuring stability moving forward.The company emphasised its commitment to reliability, noting that Cyber Monday represents a critical moment for merchants worldwide.“We know how important this day is for our merchants, and we worked urgently to bring systems back online,” Shopify said.The Shopify outage started around a sensitive time as the Cyper Monday sale is seen as a large revenue generator for small and medium-sized businesses. Many merchants also shared their plight on social media.Analysts noted that even a few hours of downtime can translate into millions in missed transactions across Shopify’s global merchant base.With the services now being restored, Shopify is said to conduct a full investigation of the service outage in order to prevent such incidents in the future. Also, the swift resolution carried out the by the company helped to limit the damage.","Shopify, the e-commerce major faced a widespread outage on Cyber Monday (December 1) Thousands of merchants were not able to process orders during the peak holiday traffic. The outage started around Monday afternoon and it affected the core services such as checkout, storefronts and admin dashboards.","https://static.toiimg.com/thumb/msid-125708450,imgsize-12202,width-400,resizemode-4/shopify-down-when-will-the-services-be-restored-latest-update-on-major-cyber-monday-outage.jpg"
"After outages that brought down half the internet, Google and Amazon join hands: Here's what it means",https://timesofindia.indiatimes.com/technology/tech-news/after-outages-that-brought-down-half-the-internet-google-and-amazon-join-hands-heres-what-it-means/articleshow/125704052.cms,"



In a move signaling a shift toward greater cooperation in the competitive cloud market, Amazon Web Services (AWS) and Google Cloud introduced a jointly developed multicloud networking service on Sunday. The initiative aims to bolster internet reliability and drastically reduce the time required to connect disparate computing platforms. The collaboration comes as the tech industry faces increasing pressure to prevent costly service disruptions. The new offering arrives just over a month after a massive AWS outage on October 20 knocked major applications -- including Snapchat and Reddit—offline. That single event is estimated to cost U.S. companies between $500 million and $650 million in losses, according to analytics firm Parametrix.The new service combines AWS’ Interconnect-multicloud with Google Cloud’s Cross-Cloud Interconnect. According to the companies, this integration allows customers to establish private, high-speed links between the two platforms in ""minutes instead of weeks."" ""This collaboration between AWS and Google Cloud represents a fundamental shift in multicloud connectivity,"" said Robert Kennedy , Vice President of Network Services at AWS.Rob Enns, Vice President and General Manager of Cloud Networking at Google Cloud, noted that the joint network is designed to streamline the movement of data and applications between clouds, addressing a longstanding friction point for enterprise clients.Tech giant Salesforce was named as one of the early adopters of this new interoperable approach.The partnership occurs against a backdrop of surging demand for digital infrastructure, driven largely by the rapid adoption of artificial intelligence. Major players, including Alphabet, Microsoft, and Amazon, are currently investing billions to expand capacity to handle this increased traffic.While the two companies are collaborating on connectivity, they remain fierce competitors. AWS retains its position as the world's largest cloud provider, followed by Microsoft Azure and Google Cloud. In the third quarter, Amazon’s cloud business generated $33 billion in revenue -- more than double Google Cloud's $15.16 billion.However, as internet disruptions become more expensive and disruptive, the new partnership suggests that interoperability is becoming a business necessity even for market leaders.",Amazon Web Services and Google Cloud introduce a jointly developed multicloud networking service. The initiative aims to bolster internet reliability and drastically reduce the time required to connect disparate computing platforms. The collaboration comes as the tech industry faces increasing pressure to prevent costly service disruptions.,"https://static.toiimg.com/thumb/msid-125704045,imgsize-73606,width-400,resizemode-4/google.jpg"
Amazon opens 2 micro-fulfillment centers daily as 10-minute Amazon Now delivery demand surges,https://timesofindia.indiatimes.com/technology/tech-news/amazon-opens-2-micro-fulfillment-centers-daily-as-10-minute-amazon-now-delivery-demand-surges/articleshow/125701241.cms,"Amazon India is rapidly expanding its ultra-fast delivery service, aiming for 10-minute deliveries across Bengaluru, Delhi, and Mumbai. With plans to open two micro-fulfillment centers daily, the company expects over 300 centers by year-end. This aggressive move is driven by Prime members tripling their shopping frequency for daily essentials, signaling a significant shift in urban Indian shopping habits.","Amazon India is rapidly expanding its ultra-fast delivery service, aiming for 10-minute deliveries across Bengaluru, Delhi, and Mumbai. With plans to open two micro-fulfillment centers daily, the company expects over 300 centers by year- end. This aggressive move is driven by Prime members tripling their shopping frequency for daily essentials.","https://static.toiimg.com/thumb/msid-125701241,imgsize-26994,width-400,resizemode-4/125701241.jpg"
"Internet's CatGPT's landline-style phone goes viral; ‘Zillennial’ founder generates $280,000 selling Bluetooth 'landlines' to combat screen time",https://timesofindia.indiatimes.com/technology/tech-news/internets-catgpts-landline-style-phone-goes-viral-zillennial-founder-generates-280000-selling-bluetooth-landlines-to-combat-screen-time/articleshow/125700427.cms,"Representative Image

How landline-style phone works

Connectivity:

Incoming Calls:

Outgoing Calls:

CatGPT says: I brought back landlines

Cat Goetze has two Instagram posts where she shares details of her phone.

First Instagram Post

Second Instagram Post





Cat Goetze, a tech founder known online as ""CatGPT,"" has turned a personal quest for nostalgia into a six-figure business, banking on a generation’s desire to disconnect. According to a report by CNBC Make It, Goetze’s startup, Physical Phones, generated $120,000 in sales in its first three days after going viral on social media in July 2025. By the end of October, the business had sold over 3,000 units, totaling $280,000 in revenue. The product—a retro-styled handset that looks like a traditional landline but connects to smartphones via Bluetooth—was born out of Goetze’s desire to reduce her own screen time without sacrificing connectivity.Two years ago, Goetze sought to replace her smartphone usage with something ""low-tech."" However, she discovered that installing a true landline in her apartment was both expensive and logistically difficult.""I was kind of just sitting around [thinking] it’d be so cute if we still had landline phones and you could twirl the cord and talk with your friends,"" Goetze told CNBC Make It. ""That just felt nostalgic and chic to me.""Taking matters into her own hands, Goetze ""hijacked"" a thrifted landline phone and engineered it to be Bluetooth compatible. For two years, the pink clamshell device served as her primary communication hub at home, allowing her to take calls and even buzz guests into her building.When she finally unveiled the device to her social media audience in July 2025, she anticipated a modest response, setting up a shop hoping for 15 to 20 pre-orders she could build manually. Instead, the demand was instantaneous.""It literally felt like we had captured lightning in a bottle,"" she told the CNBC.Physical Phones are currently available in five styles ranging from $90 to $110. While Goetze originally built them by hand, she has since partnered with an electronics manufacturer, with the first major batches shipping this December.The devices function as an extension of a user’s smartphone:Pairs with iPhone and Android via Bluetooth.The device rings for standard calls as well as audio/video calls from apps like WhatsApp, FaceTime, Instagram, and Snapchat.Users can dial numbers directly or use the star key (*) to activate voice assistants (like Siri or Google Assistant) to dial contacts by name.R u reading this caption because the video started to get boring?Ur gonna check the comments next huh?It’s ok.That’s your brain looking for more rustling leaves in the Savannah.If that doesn’t make sense, you just haven’t gotten far enough in the video yet.Force 1= tech companies. They get paid more $ the longer you stay here, so they wanna hook u. Bad.Force 2= about two thousand centuries of evolution. Your brain is hardwired to reward noticing novel, unexpected things. Your feed is a FLOOD of novel, unexpected things. The rewards feel so good, it almost feels like a trance-like state.Dont feel bad. We all have monkey brains. How do u think we got here?!!!But u can protect ur monkey brain. In the next video I’ll explain 3 tricks I used to get off of social media for 5 years.I’m committed to bringing down my screen time this year but I know I need to be reachable in case of emergency. Also, living out my nostalgic 90s dream is very important to me.YES it takes FaceTime Audio and WhatsApp calls.YES it works with AndroidNO, you will not know who’s calling. Like the olden days.YES they are the coolest cutest things ever.","Cat Goetze, a tech founder known online as ""CatGPT,"" has turned a personal quest for nostalgia into a six-figure business. Her startup, Physical Phones, generated $120,000 in sales in its first three days after going viral on social media in July 2025.","https://static.toiimg.com/thumb/msid-125700440,imgsize-112496,width-400,resizemode-4/retro-futuristic-connection.jpg"
"Nvidia, SoftBank-backed startup Runway launches AI video model, claims it beats Google and ChatGPT-maker OpenAI",https://timesofindia.indiatimes.com/technology/tech-news/nvidia-softbank-backed-startup-runway-launches-ai-video-model-claims-it-beats-google-and-chatgpt-maker-openai/articleshow/125699140.cms,"Nvidia Makes History: First Company to Hit $4 Trillion Market Cap

It’s a David-versus-Goliath victory: Runway CEO







Artificial intelligence (AI) startup Runway has launched its Gen 4.5 model, claiming that its video generation capabilities outperform rival models from industry giants Google and OpenAI in an independent benchmark. Runway, a company that specialises in AI video research and modeling and is backed by SoftBank, says its new model allows users to generate high-definition videos from written prompts, demonstrating a superior grasp of physics, human motion, camera movements and cause-and-effect sequences.According to a report by CNBC, the startup cites independent AI benchmarking and analysis company Artificial Analysis for its bold claim, saying Gen 4.5 immediately secured the top spot on the company's Video Arena leaderboard. The rankings are determined through blind comparisons where users vote for their preferred output without knowing which company generated the video.The results place Google's Veo 3 model in second place, and OpenAI’s Sora 2 Pro model significantly lower in seventh place.Runway CEO Cristóbal Valenzuela framed the achievement as a David-versus-Goliath victory.“We managed to out-compete trillion-dollar companies with a team of 100 people.""You can get to frontiers just by being extremely focused and diligent,"" Valenzuela told CNBC, noting that Gen 4.5 was codenamed ""David"" internally.“It does feel like a very interesting moment in time where the era of efficiency and research is upon us,” Valenzuela said on the shifting landscape. He added that the company is “excited to be able to make sure that AI is not monopolized by two or three companies.”Gen 4.5 is rolling out gradually and is expected to be available to all of Runway’s customers by the end of the week.",Runway claims its Gen 4.5 video model outperforms Google and OpenAI in independent benchmarking. Runway is a company that specialises in AI video research and modeling and is backed by SoftBank. CEO Cristóbal Valenzuela framed the achievement as a David-versus-Goliath victory. The new model is expected to be available to all of Runway’s customers by the end of the week.,"https://static.toiimg.com/thumb/msid-125699181,imgsize-4582,width-400,resizemode-4/runway.jpg"
“I’m a big fan of anyone who…”: Elon Musk’s advice to Indian entrepreneurs goes viral on Nikhil Kamath’s podcast,https://timesofindia.indiatimes.com/technology/tech-news/im-a-big-fan-of-anyone-who-elon-musks-advice-to-indian-entrepreneurs-goes-viral-on-nikhil-kamaths-podcast/articleshow/125692751.cms,"Elon Musk: A Different Conversation w/ Nikhil Kamath | Full Episode | People by WTF Ep. 16

Why Elon Musk’s advice to Indian entrepreneurs matters

What does Elon Musk’s advice to Indian entrepreneurs highlight about building useful products

Elon Musk’s advice to Indian entrepreneurs focuses on hard work and patience

How Indian entrepreneurs can apply Elon Musk’s advice in a practical way

Also read|





In a recent episode of the popular podcast People by WTF hosted by Indian entrepreneur Nikhil Kamath, Elon Musk shared advice that has quickly gone viral across India. His message, directed towards young Indian entrepreneurs, emphasised the importance of focusing on building useful products and services rather than chasing wealth directly. Musk expressed admiration for creators who genuinely want to contribute something meaningful to society and encouraged founders to build with purpose, resilience and long-term commitment. The podcast sparked wide discussion across social media as many viewers reflected on whether shifting attention from profit to problem-solving could transform India’s fast-growing entrepreneurial landscape and inspire more sustainable innovation across sectors and communities today.During the conversation, Musk said he is a big fan of anyone who wants to build and who wants to create more value than they consume. He encouraged entrepreneurs to focus on solving real problems rather than pursuing rapid financial gain. According to him, when businesses genuinely aim to provide something useful, success naturally follows. The emphasis on meaningful contribution resonated deeply because many new founders feel pressured to grow fast, seek investment early and measure success only by valuation or revenue.Musk’s view suggests that long-term growth depends more on usefulness than hype and that sustainable companies are built by solving needs that truly matter.This perspective reinforces patient innovation by encouraging creators to prioritize authenticity, resilience, thoughtful design, and community impact across every undertaking.Musk’s comments urge Indian entrepreneurs to place value creation at the centre of their strategy. Instead of replicating existing products or following trends simply to seek profit, he encouraged founders to identify gaps in society and build solutions that genuinely improve life for others. Useful products, he suggested, should be the foundation of every venture because they shape trust, create resilience and last longer than businesses based purely on momentum or marketing. The growing pace of India’s digital and industrial development means opportunities are vast. From affordable technology and education to rural services and healthcare systems, providing real utility remains one of the strongest paths to making an impact.Musk also noted that entrepreneurship involves significant sacrifice, long hours and emotional pressure. He explained that success rarely comes instantly and that building something valuable requires patience and willingness to face failure without giving up. Many startups collapse because the desire for quick results overrides perseverance. His advice encourages young builders to stay committed to their vision, work consistently and remain grounded when setbacks appear. Hard work, combined with purpose, becomes the fuel for meaningful growth. Entrepreneurs who endure difficult phases often become the ones who eventually change industries and create progress.Entrepreneurs inspired by Musk’s message can start by observing real issues around them. Identifying everyday challenges within families, workplaces, or communities offers the strongest foundation for innovation. Instead of beginning with fundraising or branding, entrepreneurs can work on developing small prototypes and testing them directly with users. Listening to feedback, improving continuously, and prioritising quality over speed can lead to stable growth. Additionally, choosing long-term thinking helps build businesses that contribute genuine value rather than temporary excitement. Musk’s approach suggests that profits will follow naturally when a solution solves a real problem.The reason Musk’s message is spreading quickly across India is simple. It replaces pressure with purpose. It reminds young founders that meaningful contribution matters more than chasing financial success alone. In a country that is witnessing an explosion of startups and innovation, his advice encourages a mindset shift towards usefulness, resilience and long-term thinking. By focusing on building valuable products and services that help people, entrepreneurs can create lasting change and shape industries for generations. For those dreaming of success, the message is powerful: build something useful, contribute positively, and the results will follow in time.","In a recent episode of the popular podcast People by WTF, Elon Musk shared advice that has quickly gone viral across India. His message, directed towards young Indian entrepreneurs, emphasised the importance of focusing on building useful products and services rather than chasing wealth directly. Musk expressed admiration for creators who genuinely want to contribute something meaningful to society.","https://static.toiimg.com/thumb/msid-125693108,imgsize-19616,width-400,resizemode-4/im-a-big-fan-of-anyone-who-elon-musks-advice-to-indian-entrepreneurs-goes-viral-on-nikhil-kamaths-podcast.jpg"
"Ford CEO says: We are in deep trouble when you compare us to China, because …",https://timesofindia.indiatimes.com/technology/tech-news/ford-ceo-says-we-are-in-deep-trouble-when-you-compare-us-to-china-because-/articleshow/125696539.cms,"A national security concern



Lesson learned from COVID



A national challenge







Ford Motor company CEO Jim Farley recently shared his thoughts on America’s labour future. He revealed that the company is struggling to fill around 5,000 skilled-mechanic roles despite offering salaries around $120,000. Now once again, Farley has said that the realm crises facing America is the shortage of trade workers. In an appearance on the Office Hours: Business Edition podcast, Farley issued a warning that the US is dangerously behind countries like China when it comes with building and sustaining essential workforce. Farley didn’t mince words: “We are in deep trouble when you compare us to China,” he said, pointing to the lack of skilled labor across critical sectors. According to him, more than 1 million jobs are currently sitting empty in emergency services, trucking, plumbing, factory work, and other trades.Farley stressed that this shortage is not just about filling jobs, but it is about safeguarding the country’s ability to function in times of crises. He also argued that skilled traders are the backbone of the US economy and national resilience, but still US is failing to invest in training and education to replenish this workforce.Farley’s grandfather who worked on Ford’s assembly line, has also been vocal about the need to rebuild the pipeline for blue collar workers. “Those hardworking jobs made our country what it is,” he said. “We do not have trade schools. We are not investing in educating a next generation… of people like my grandfather who had nothing, who built a middle-class life and a future for his family.”This is the only conviction which led Ford to become the first major automaker to ratify union agreements during recent labour negotiations in both the US and Canada. “I’m so proud of us,” Farley said. “We got rid of the lower tier, paid everyone the same. Now those people have a career at Ford like my grandfather.”Farley also shared his thoughts on how the pandemic exposed the cracks present in the wage system. He said that many workers told him that they were juggling between multiple jobs in order to make the ends meet. In response to this, Ford altogether eliminated its two-tier wage structure and gave employees a clear path to financial stability, which Farley think is important for workforce rebuilding.Farley also emphasised that this not just the problem of Ford. He mentioned that the solution to this lies in public-private cooperation, education reform and cultural respect for manual work. “If we work together like we always have in America… and we get after this with the government, with education… I think we can solve this. But we have a lot of work to do.”","Jim Farley, CEO of Ford Motor Company, said that the US is in trouble when it comes to building and sustaining a skilled workforce. More than 1 million jobs are currently sitting empty in emergency services, trucking, plumbing, factory work, and other trades. Farley argued that skilled traders are the backbone of the US economy.","https://static.toiimg.com/thumb/msid-125696524,imgsize-29754,width-400,resizemode-4/ford-ceo-warns-us-of-a-workforce-crisis-quotwe-have-5000-skilled-mechanic-jobs-unfilled-even-with-a-120000-salaryquot.jpg"
