Article Title,Article Link,Article Text,Article Summary,Article Image
North Carolina fire: Raleigh convention center engulfed in massive blaze,https://timesofindia.indiatimes.com/world/us/north-carolina-fire-raleigh-convention-center-engulfed-in-massive-blaze-watch/articleshow/125711556.cms,"



A fire on the roof of the Raleigh convention center was contained within an hour on Monday night after a natural gas incident sparked flames around 9.30pm, according to city of Raleigh officials. No injuries were reported.City spokeswoman Julia Milstead told WRAL that the blaze was restricted to the roof and did not spread into the building’s interior. Lights remained on inside the centre during the incident, and no nearby structures were affected, even as flames and smoke were visible across downtown.Milstead said security staff were inside when the fire broke out but were able to exit quickly. Around 50 firefighters responded, and operations began scaling down by 10.45pm, though crews were expected to remain at the site overnight. Residents were advised to avoid the area while work continued.Videos on social media show flames shooting from the rooftop minutes after the fire started. No events were underway at the time.Raleigh mayor Janet Cowell described the convention centre as an “important civic asset” and said officials would meet at City Hall on Tuesday for updates. “I hope we can repair damage and have it back functioning normally as soon as possible,” she said.According to the convention centre’s website, the North Carolina cybersecurity summit is scheduled for Wednesday and Thursday, followed by a holiday event on Friday. While Milstead confirmed no internal damage, it remains unclear how the roof incident might affect upcoming events.WRAL meteorologist Kat Campbell noted that calm winds aided firefighting, but nearly an inch of rain was forecast for Tuesday. Officials have not yet indicated whether roof damage could lead to leaks.WRAL said further updates would be provided overnight and during its morning bulletin from 4.30am.",A natural gas incident sparked a fire on the roof of the Raleigh convention center. The blaze was contained within an hour and no injuries were reported. No events were underway at the time of the incident. Officials have not yet indicated whether roof damage could lead to leaks.,"https://static.toiimg.com/thumb/msid-125711571,imgsize-641873,width-400,resizemode-4/raleigh-convention-center-on-fire-x.jpg"
Retiring in the UAE? How much a 5-year retirement visa will cost you and the benefits you get,https://timesofindia.indiatimes.com/world/middle-east/retiring-in-the-uae-how-much-a-5-year-retirement-visa-will-cost-you-and-the-benefits-you-get/articleshow/125684586.cms,"Retirees aged 55+ can secure a UAE 5-year visa with AED 1 million in savings, property, or income/ AI representative Image

Israel’s Arab Ally Draws Red Line After ‘Dangerous Escalation’ In Syria | Abraham Accords In Crisis?



What is the UAE retirement visa and who can apply?

Eligibility criteria (Federal regulations)





Minimum age: 55 years or older

Work experience: Minimum of 15 years of cumulative work experience, whether inside or outside the UAE

Own property in the UAE valued at AED 1 million or more — $270,000 or more

Have savings of at least AED 1 million — $270,000

Receive a minimum monthly income of AED 20,000 — $5,400

Visa validity and renewal





The retirement visa is issued for a five-year period

Renewable upon continued fulfillment of the eligibility conditions

Offers a pathway for long-term stability in the UAE post-retirement

Application process – Step-by-step through ICP





How to apply





Log in via UAE Pass or username/password – Secure digital identity login Select Services – Choose “UAE ID and Residency Services” Review and Update Data – Verify all auto-retrieved personal and financial information and make necessary updates Payment and Delivery – Pay applicable fees and receive the Emirates ID via approved delivery services



Special Retirement Visa Program by Dubai





Minimum annual income of AED 180,000 (or monthly income of AED 15,000) — $48,600 annually or $4,050 monthly

Fixed deposit savings of AED 1 million maintained for at least 3 years — $270,000

Ownership of unmortgaged property worth AED 1 million in Dubai — $270,000

A combined financial portfolio (savings + property) totaling at least AED 1 million — $270,000

Required documents for each applicant category





For foreign retired real estate owners

Applicants applying through real estate ownership must submit:

Copy of passport

Proof of property ownership or property evaluation certificate issued by the Land and Property Department

For foreign pensioners who own a deposit

Personal photo

Copy of passport

Certificate of financial deposit

Acknowledgment letter confirming the transfer of the deposit into the UAE

For Foreign Pensioners With Annual Income

Personal photo

Copy of passport

Bank account statement for the last six (6) months

Letter from an official body indicating the source of income

Fees, costs, and other considerations

Estimated costs:





Medical Examination: AED 700 ($189)

Emirates ID: AED 653 ($176.31)

Visa Fees: AED 2,256.75 ($609.32)

Dubai Land Department (DLD) Fees: AED 2,020 ($545.40)

(DLD) Fees: AED 2,020 ($545.40) Administrative DLD Fees: AED 1,155 ($311.85)

Health Insurance: Variable, depending on applicant’s age and provider

(excluding insurance)

Benefits and strategic context

Key benefits for retirees:





No income, property, or wealth tax

Sponsorship eligibility for spouse and dependent children

Access to top-tier healthcare across the UAE

Multiple entry/exit flexibility without residency disruptions

Long-term lifestyle security through renewable 5-year terms

Strategic vision

Broader visa reforms in 2025





Thinking about retirement abroad? The UAE isn’t just a playground for investors and professionals, it’s also emerging as a smart, tax-friendly destination for retirees. With its 5-year renewable retirement visa, financially stable expatriates aged 55 and above can enjoy long-term residency without needing a job or running a business.But what does it really take to retire here? From minimum savings and property requirements to monthly income thresholds, understanding the costs, and planning wisely, can make the difference between a smooth move and a financial headache. Beyond the numbers, the visa offers clear perks: no income or property tax, access to world-class healthcare, and the freedom to bring your spouse and dependents along for a secure, comfortable lifestyle.Here’s a complete breakdown of the financial requirements, application steps, and benefits of the UAE retirement visa, so you can see if it makes sense for your retirement plans.The UAE’s retirement visa program provides a 5-year renewable residency option for foreign retirees who wish to settle in the country after their working years. The policy is applicable across all emirates, with Dubai offering an additional customized version of the program.It was officially introduced by the Federal Authority for Identity, Citizenship, Customs, and Port Security (ICP) in December 2024, as part of a broader federal update to residency and ID regulations aimed at creating more flexible long-term visa pathways.Applicants must meet all of the following base criteria:In addition, applicants must fulfill at least one of the following financial conditions:Special Case (Dubai Only): Dubai residents are eligible with a lower income threshold of AED 15,000 ($4,050) per month.Applicants are also required to submit a bank statement from the past six months to confirm financial eligibility.The ICP (Federal Authority for Identity, Citizenship, Customs, and Port Security) manages the retirement visa application process through its digital platforms, namely the official ICP website and the UAEICP smart application.The process involves four primary steps through the UAEICP smart application or official website:In addition to federal guidelines, Dubai offers its own retirement visa initiative, tailored to attract global retirees, their spouses, and dependents. It comes with a choice of four financial qualification options, any one of which would make the applicant eligible:This flexibility allows applicants to tailor their approach based on income, assets, or a mix of both. Foreign applicants can apply through the GDRFAD website under the section titled ‘Issuing a residence permit for the retired foreigner’.To complete the application for the UAE Retirement Visa, applicants must provide documents specific to the financial route they are applying under. The documentation ensures the applicant meets eligibility criteria and supports the processing of the visa.Applicants applying through a financial deposit must submit:Applicants applying through regular income must submit:Note: All documents must be valid and clearly support the financial eligibility route chosen by the applicant. Failure to provide complete documentation may result in delays or rejection.While referred to by some as a “free” visa in media reports, the UAE retirement visa does involve multiple fees for processing, medical testing, and administrative services.Total Estimated Range: AED 2,300 to AED 3,800 ($621 to $1,026)These figures highlight that, while the visa is employment-independent, it is not fee-exempt, and applicants should budget accordingly.The retirement visa is more than just a residency document, it’s a cornerstone of the UAE’s broader strategy for global competitiveness and population diversification.The program strongly aligns with the UAE’s Vision 2031, aimed at diversifying national income sources, significantly increasing global talent retention, and transforming the Emirates into a full-spectrum and vibrant destination — not just for careers but also for retirement, investment, and overall holistic quality of life, reinforcing a strategic and inclusive framework that supports long-term enduring opportunities.The retirement visa is part of the UAE’s broader 2025 residency reforms aimed at attracting long-term residents across diverse sectors. Recent additions include the Blue Visa for environmental experts, expanded Golden Visas for teachers, nurses, digital content creators, and luxury yacht owners, and an enhanced Golden Visa for e-sports and gaming professionals. The rollout also features AI-driven processing for faster approvals, reflecting the UAE’s push for a more inclusive and efficient residency framework. These visa updates reinforce the UAE’s goal to attract and support residents at every stage of life.","Retirees aged 55+ can secure a UAE 5-year visa with AED 1 million in savings, property, or income. The visa offers no income, property tax, or wealth tax for spouse and dependent children. The UAE is emerging as a smart, tax-friendly destination for retirees.","https://static.toiimg.com/thumb/msid-125684802,imgsize-977865,width-400,resizemode-4/uae-retirement-visa.jpg"
"‘They lose a limb, bleed out’: Megyn Kelly says she wants alleged drug traffickers to ‘suffer’ at the hands of Trump and Hegseth",https://timesofindia.indiatimes.com/world/us/they-lose-a-limb-bleed-out-megyn-kelly-says-she-wants-alleged-drug-traffickers-to-suffer-at-the-hands-of-trump-and-hegseth/articleshow/125717813.cms,"US Senators Demand Legal Review of Donald Trump’s ‘Drug Boat’ Strikes Amid War Crime Allegations

So I really do kind of not only want to see them killed in the water, whether they’re on the boat or in the water, but I’d really like to see them suffer.

I would like Trump and Hegseth to make it last a long time so that they lose a limb and bleed out a little.

: ""Like I’m really having a difficult time ginning up sympathy for these guys who ten seconds earlier almost got taken out by the initial bomb, but because they managed to get ejected, you know, a little too soon, had to be taken out in the water.

I realize legally it may make a difference, but truly, Mark, this is a tough case to really gin up the sympathies of the American people.""

War crime or not?

In a word, they were illegal. It is a core principle of the rule of law and of the law of war that you cannot target and kill people who have been rendered incapacitated or defenseless. That conflicts with the Geneva Convention.





MAGA commentator Megyn Kelly held back no punches and clarified that she wants a harsh and gruesome fate for alleged drug traffickers entering the US. Kelly said she has no empathy for the peddlers and would like to see them ""suffer"" at the hands of US President Donald Trump and War Secretary Pete HegsethIn a segment on The Megyn Kelly Show, the conservative pundit said she would prefer that alleged drug traffickers killed in the September Caribbean boat strikes suffer a slow and painful death rather than a swift one.This comes after the White House confirmed that a top US Navy admiral ordered a second round of strikes on an alleged Venezuelan drug boat in September, reports BBC.Kelly was defending maritime strikes by the US military in which boats carrying suspected “narco-terrorists” were reportedly attacked, including a controversial second strike called a “double tap,” carried out even after the initial assault had already disabled the vessels and forced survivors into the water, where those still floating were killed in the second strike.Opposition lawmakers and legal experts condemned the follow-up attack on survivors as a violation of international law, possibly constituting a war crime.Speaking to journalist Mark Halperin, Kelly described in detail what she would wish upon such “narco-terrorists"": ""Kelly also claimed the second strike was necessary to protect American peopleCNN senior legal analyst Elie Honig said that the second strike in September was no doubt a war crime:On Monday, White House sress secretary Karoline Leavitt said that Hegseth authorised the strikes but did not give an order to ""kill everybody"", as the report said.More than 80 people have been killed in similar strikes in the Caribbean Sea since early September. US officials typically release a short, grainy video after each operation, and POTUS also posts the clips on his Truth Social platform, but they provide no evidence of drug trafficking and give few details about who or what was on the boats.The Trump administration says the strikes are carried out in self-defence and target boats transporting illicit drugs to the United States.",Conservative pundit Megyn Kelly said she would prefer that alleged drug traffickers killed in the September Caribbean boat strikes suffer a slow and painful death rather than a swift one. Kelly was defending maritime strikes by the US military in which boats carrying suspected “narco-terrorists” were reportedly attacked. She also claimed the second strike was necessary to protect American people.,"https://static.toiimg.com/thumb/msid-125717813,imgsize-521485,width-400,resizemode-4/125717813.jpg"
Zohran Mamdani to be 111th NYC mayor? Historian refutes; challenges number count,https://timesofindia.indiatimes.com/world/us/zohran-mamdani-to-be-111th-nyc-mayor-historian-refutes-challenges-number-count/articleshow/125714705.cms,"New research by historian Paul Hortenstine suggests Zohran Mamdani will be New York City's 112th mayor, not the 111th. This is due to a previously unlisted nonconsecutive term served by Matthias Nicolls in 1674-75. The omission cascades through historical records, renumbering subsequent mayors.","New research suggests Zohran Mamdani will be New York City's 112th mayor. This is due to a previously unlisted nonconsecutive term served by Matthias Nicolls in 1674-75. The omission cascades through historical records, renumbering subsequent mayors.","https://static.toiimg.com/thumb/msid-125714787,imgsize-716424,width-400,resizemode-4/zohran-mamdani-ap.jpg"
Setback to Trump: Appeals court says Alina Habba ‘unlawful’ US attorney; second legal blow in a week,https://timesofindia.indiatimes.com/world/us/setback-to-trump-appeals-court-says-alina-habba-unlawful-us-attorney-second-legal-blow-in-a-week/articleshow/125714484.cms,"Maduro Defies Trump With Fierce Oath, Declares Unbreakable Loyalty; ‘No Slaves Peace For Venezuela’





A federal appeals court on Monday ruled that Alina Habba had been serving unlawfully as the US attorney in New Jersey, delivering a major setback to the Trump administration and potentially setting up a fight before the US Supreme Court . The three-judge panel in Philadelphia upheld an earlier district court ruling that the administration’s efforts to keep Habba in the post sidestepped statutory requirements.Habba, who was neither Senate-confirmed nor appointed by district judges - the traditional routes for US attorney appointments - had her authority challenged by defendants in New Jersey. The panel noted that the government’s maneuvers reflected frustration with “legal and political barriers to placing its favored US attorneys in charge,” adding that “the citizens of New Jersey and the loyal employees in the US attorney’s office deserve some clarity and stability. ”The ruling leaves uncertain how ongoing matters in New Jersey’s federal courts will proceed. Some grand jury proceedings and criminal cases had already slowed due to the ambiguity over Habba’s status. Neither the justice department nor Habba’s office responded immediately to requests for comment.The lawyers who brought the challenge - Abbe D Lowell, Gerald Krovatin and Norm Eisen - said the decision showed that “President Trump cannot usurp longstanding statutory and constitutional processes to insert whomever he wants in these positions.”They pledged to continue contesting what they called “President Trump’s unlawful appointments of purported US attorneys.”The case could become the first of its kind to reach the Supreme Court, though a similar dispute in Virginia involving US attorney Lindsey Halligan may advance quickly. A federal judge there also found Halligan’s appointment unlawful last week, and the justice department plans to appeal.Habba, 41, previously represented Donald Trump in civil matters and was active in his 2024 campaign. She had no criminal law experience when Trump named her to a 120-day interim term. Her permanent nomination stalled due to opposition from New Jersey’s Democratic senators Cory Booker and Andy Kim.In July, district judges declined to extend her tenure and appointed veteran prosecutor Desiree Leigh Grace instead - prompting attorney general Pam Bondi to dismiss Grace and reinstate Habba through a series of unusual administrative steps.The appeals court found each of those steps invalid. It rejected the administration’s claim that Habba could automatically ascend to acting US attorney as “first assistant,” and deemed her simultaneous designation as a “special attorney” “plainly prohibited.” The decision affirms a ruling by chief judge Matthew W. Brann, who concluded Habba had lacked authority since July 1.This marks the second major legal blow for Habba and Trump in a week. Days earlier, the 11th circuit upheld nearly $1 million in sanctions imposed on them for filing “frivolous” lawsuits against several Trump critics, including Hillary Clinton and former FBI director James Comey.","Alina Habba was neither Senate-confirmed nor appointed by district judges. She had no criminal law experience when Trump named her to a 120-day interim term. Her permanent nomination stalled due to opposition from New Jersey’s Democratic senators. Habba, 41, previously represented Donald Trump in civil matters.","https://static.toiimg.com/thumb/msid-125714521,imgsize-1231187,width-400,resizemode-4/donald-trump-and-alina-habba-ap.jpg"
"US exclusive citizenship act: MAGA senator accidentally targets Melania, Barron Trump",https://timesofindia.indiatimes.com/world/us/us-exclusive-citizenship-act-maga-senator-accidentally-targets-melania-barron-trump-what-the-bill-proposes/articleshow/125712900.cms,"Melania Glitches Onstage While Trump Claps On Loop: 'Where Is The First Lady?'





A proposed law by Republican Bernie Moreno could force many US citizens - including Melania Trump and Barron Trump - to choose between their US citizenship and any foreign citizenship they hold. Moreno, an Ohio senator, plans to introduce legislation named the Exclusive Citizenship Act of 2025, which would end dual citizenship by requiring citizens to declare their “exclusive allegiance” to the United States.Moreno, who was born in Colombia but renounced his Colombian citizenship, told Fox News Digital: “One of the greatest honors of my life was when I became an American citizen at 18, the first opportunity I could do so.”He added, “It was an honor to pledge an oath of allegiance to the United States of America and only to the United States of America.” He argued: “Being an American citizen is an honor and a privilege - and if you want to be an American - it’s all or nothing. It’s time to end dual citizenship for good.”According to The Daily Beast, both Melania and Barron Trump - who hold US and Slovenian citizenship - would be directly affected if the bill becomes law.Melania, originally from Slovenia, became a naturalised US citizen in July 2006. Barron reportedly retains Slovenian citizenship via his mother, and holds a Slovenian passport, which would be rendered invalid under Moreno’s plan.Under the proposed law, the US department of state and the department of homeland security would be tasked with identifying citizens holding dual nationality. Such individuals would then have one year to renounce their foreign citizenship - otherwise they would automatically lose US citizenship and be reclassified as non-citizens under immigration law.Critics of the bill say it could uproot lives of Americans who for generations have legally held dual nationality. Supporters argue dual citizenship may pose “conflicts of interest and divided loyalties,” as stated by Moreno.At present, US law allows citizens to hold multiple citizenships without the requirement to renounce any, meaning the new legislation - if passed - would mark a significant shift in US immigration and nationality policy.The move is already drawing attention, especially given its potential impact on members of the current First Family. Debate is likely to intensify should the bill be formally introduced in Congress.","Ohio senator Bernie Moreno plans to introduce legislation to end dual citizenship. If passed, US citizens would have to choose between their US citizenship and any foreign citizenship they hold. Both Melania and Barron Trump - who hold US and Slovenian citizenship - would be directly affected if bill becomes law.","https://static.toiimg.com/thumb/msid-125713763,imgsize-981591,width-400,resizemode-4/melani-and-barron-trump-x.jpg"
