Article Title,Article Link,Article Text,Article Summary,Article Image
'No proof of life': Imran Khan’s son sparks new round of doubts amid ex-PM's health rumours; who said what?,https://timesofindia.indiatimes.com/world/pakistan/no-proof-of-life-imran-khans-son-sparks-new-round-of-doubts-amid-ex-pms-death-rumors-who-said-what/articleshow/125627255.cms,"Ex-Pakistan PM Imran Khan (File photo)

Pakistan Erupts As Imran Khan’s Son Claims ‘No Proof Of Life’ Amid CM Afridi’s Jail-Side Protest

'Darkest period' in Pakistan, says sister

Noreen Niazi

ALSO READ |

'Nothing is wrong with him'

ALSO READ |

UN calls on Pakistan to respect Imran Khan's human-rights





Former Pakistani prime minister Imran Khan 's son Kasim Khan on Thursday claimed his father has been kept in a ""death cell with zero transparency"", despite Islamabad refuting rumours that the cricketer-turned-politician was “brutally” assaulted by police for seeking a meeting with their brother last week.Kasim Khan said there have been ""no phone calls, no meetings and no proof of life. Me and my brother have had no contact with our father.""He alleged that the former prime minister, who has been under arrest for 845 days, has been kept in solitary confinement for the past six weeks. He also said that Khan’s sisters have been denied permission to visit him despite court orders allowing access.Kasim further alleged that the Shehbaz Sharif-led government and “its handlers” will be held accountable “legally, morally and internationally”.He also urged the international community to “intervene urgently” and demand proof of life.Earlier, Imran Khan’s sister, Noreen Niazi, accused Pakistani authorities of keeping the former prime minister in harsh prison conditions and cutting off all family contact, claiming that “no one knows what’s happening inside the jail.”Speaking to ANI about her last meeting with the Pakistan Tehreek-e-Insaf (PTI) founder, she said, “...Heis going through a tough time alone. He is in isolation... As per the jail manual, one can't be placed in isolation for more than 4 days. But he was put in isolation for three weeks last year as well, during which electricity was switched off, and he wasn't even allowed to read books. The same has been done now.”Her allegations come against the backdrop of growing speculation about Khan’s health and the month-long blackout on family and legal visits. “We don't know anything. They are not telling us anything, nor are they letting anybody meet him,” she said, adding that even PTI members with approved meetings were prevented from entering.“We have not been allowed to meet him for the last four weeks... The Police have been ordered to stop us and, I believe, also given permission to do to us whatever they want. This has never happened in Pakistan before,” she said.Niazi described the treatment of supporters and family members outside Adiala Jail as unprecedented. “No one has ever disrespected women like this, nor has anyone been oppressed this way. This is the first time in Pakistan that these people have been allowed to beat up people like there won't be any consequences, without considering if it's a child, an elderly person, or a woman in front of them. The world is aware of what's happening in Pakistan. ”She called the current situation Pakistan’s “darkest period”, comparing it to “Hitler-era-like repression”, and alleged that people are being “killed, beaten, and jailed without accountability”. She argued that the continued ban on meeting Khan was intentional. “We have been going there for the last four weeks, and they are not letting us meet him. This is why such rumours are spreading.”Warning of growing frustration, she said public anger is nearing a tipping point. “I believe there will be a spark among people soon, and then they will see the level to which the people go... The oppression is too much.”Expressing no expectations from the global community, she said: ""... We have such support from outside that Trump called our dictator Asim Munir a very good friend of his... Shehbaz Sharif had lost his seat. Asim Munir helped him win, so he is the bigger force... Dictators have come before. Their fates were not good either. But how long can these people survive, or how long can they continue to oppress?""Meanwhile, adviser to the Prime Minister on Political Affairs Rana Sanaullah and senior Pakistan Tehreek-e-Insaf (PTI) leaders on Thursday rejected rumours about former prime minister Imran Khan’s deteriorating health, saying the PTI founder was “fine and nothing is wrong with him,” reported Pakistan daily Dawn News.Earlier in the day, the PTI pressed for a meeting with the jailed leader, expressing concern over his condition after he was denied access to his family and lawyers for more than three weeks. Imran has been in prison since August 2023, serving a 14-year sentence in a corruption case.His family members and party activists have been staging protests outside Adiala Jail in recent days, demanding he be allowed visitors. A PTI delegation once again attempted to meet him on Thursday, but authorities refused permission.The UN's deputy spokesperson reaffirmed that the world body has urged Pakistani authorities to ensure the human rights and due-process rights of Imran Khan are respected.This follows his arrest and ongoing legal proceedings -- the UN has emphasized that in such politically sensitive cases, fair treatment under law and procedural fairness are essential.In a response to ANI, United Nations deputy spokesperson Farhan Haq said, ""We have called for his human rights and due process rights to be respected.""","Kasim Khan claims his father has been kept in a 'death cell with zero transparency' Islamabad refutes rumours that the cricketer-turned-politician was 'brutally' assaulted by police for seeking a meeting with their brother. Imran Khan’s sister, Noreen Niazi, accused Pakistani authorities of keeping the former prime minister in harsh prison conditions.","https://static.toiimg.com/thumb/msid-125628014,imgsize-13768,width-400,resizemode-4/us-bill-seeks-sanctions-on-pakistans-army-chief-demands-imran-khans-release.jpg"
‘Hitler-era repression’: Imran Khan’s sister slams jail treatment; family barred from meetings,https://timesofindia.indiatimes.com/world/pakistan/hitler-era-repression-imran-khans-sister-slams-jail-treatment-family-barred-from-meetings/articleshow/125623777.cms,"'Darkest Times': Imran Khan's Sister Calls Out Pakistan Govt, Compares Asim Munir To Adolf Hitler





Imran Khan’s sister, Noreen Niazi, has criticized Pakistani authorities over the treatment of the former prime minister in prison, warning that his family has been kept completely in the dark and that “no one knows what’s happening inside the jail. ”Speaking to ANI about her last meeting with the Pakistan Tehreek-e-Insaf (PTI) founder, she said, “...He is going through a tough time alone. He is in isolation... As per the jail manual, one can't be placed in isolation for more than 4 days. But he was put in isolation for three weeks last year as well, during which electricity was switched off, and he wasn't even allowed to read books. The same has been done now.”Her remarks come amid a surge of rumours about Khan’s health, fuelled by the month-long blackout on family and legal meetings. “We don't know anything. They are not telling us anything, nor are they letting anybody meet him,” she said, adding that even party members with a scheduled meeting had been blocked from entering.“We have not been allowed to meet him for the last four weeks... The Police have been ordered to stop us and, I believe, also given permission to do to us whatever they want. This has never happened in Pakistan before.”Niazi described the treatment of supporters and family members outside Adiala Jail as unprecedented.“No one has ever disrespected women like this, nor has anyone been oppressed this way. This is the first time in Pakistan that these people have been allowed to beat up people like there won't be any consequences, without considering if it's a child, an elderly person, or a woman in front of them. The world is aware of what's happening in Pakistan. ”She said Pakistan had entered its “darkest period”, comparing the situation to “Hitler-era-like repression”. According to her, people are being “killed, beaten, and jailed without accountability”. The continued ban on meetings, she argues, is deliberate. “We have been going there for the last four weeks, and they are not letting us meet him. This is why such rumours are spreading.”Public anger, she warned, is reaching a breaking point. “I believe there will be a spark among people soon, and then they will see the level to which the people go... The oppression is too much.”Her comments come as PTI leaders, including Khyber Pakhtunkhwa Chief Minister Sohail Afridi, continue to be denied access to Khan, who has been held since August 2023. While Adiala Jail officials insist he is in “completely good health”, the lack of transparency has only intensified demands for a clear and verifiable update on his condition.","Noreen Niazi says family has been kept in the dark about Imran Khan's condition. Compares situation to 'Hitler-era-like repression' in Pakistan. Says people are being 'killed, beaten, and jailed without accountability'","https://static.toiimg.com/thumb/msid-125623773,imgsize-565768,width-400,resizemode-4/imran-khan.jpg"
'Getting involved in criminal activities': UAE halts visas for most Pakistanis; stops short of banning passport,https://timesofindia.indiatimes.com/world/pakistan/getting-involved-in-criminal-activities-uae-halts-visas-for-most-pakistanis-stops-short-of-banning-passport/articleshow/125617549.cms,"Image: phclondon

As Pakistan Halts Afghan Transit, Kabul Boosts India Partnership And Fast-Tracks The Chabahar Route





The UAE has stopped issuing visas to Pakistani nationals and only narrowly held back from imposing a complete ban on the Pakistani passport, a senior Pakistani interior ministry official told a parliamentary panel on Thursday.Pakistan’s additional interior secretary Salman Chaudhry informed the Senate Functional Committee on Human Rights that both the UAE and Saudi Arabia had “stopped short of imposing a ban on the Pakistani passport,” as reported by Dawn.“If a ban is imposed, getting it removed would be difficult,” Chaudhry said.Senator Samina Mumtaz Zehri, who chairs the Senate human rights committee, confirmed the interior ministry official’s account in comments to the paper.She said the travel restrictions stemmed from concerns about individuals visiting the UAE and “getting involved in criminal activities”.According to her, the committee was informed that the UAE had largely stopped issuing visas to Pakistani nationals, and that only a limited number had been granted recently, and “after much difficulty”.A Pakistani blue passport is an official travel document reserved for government officials and other eligible personnel, distinguishing it from the standard green passport issued to ordinary citizens.Meanwhile, UAE Ambassador to Pakistan Salem M Salem Al Bawab Al Zaabi briefed Pakistan's finance minister Muhammad Aurangzeb on Thursday about “major UAE visa facilitation reforms for Pakistanis,” according to a statement from the minister’s office.The statement added that nearly 500 visas were being processed daily at the newly launched UAE Visa Centre in Pakistan, outlining the reforms highlighted by the envoy.Pakistan and the UAE maintain longstanding diplomatic, economic, and cultural ties. The Gulf nation is among Pakistan’s largest trading partners in the region and a key source of remittances, supported by a sizeable Pakistani workforce residing there.However, Pakistani nationals experienced a surge in visa rejections in early July, prompting interior minister Mohsin Naqvi to take up the matter with his UAE counterpart.","The UAE has stopped issuing visas to Pakistani nationals, a senior Pakistani interior ministry official told a parliamentary panel on Thursday. The UAE and Saudi Arabia had “stopped short of imposing a ban on the Pakistani passport,” the official said.","https://static.toiimg.com/thumb/msid-125617521,width-400,resizemode-4/image-phclondon.jpg"
‘Growth model no longer good enough’: Pak central bank chief’s dire warning; calls it ‘inflection point’,https://timesofindia.indiatimes.com/world/pakistan/growth-model-no-longer-good-enough-pak-central-bank-chief-warns-calls-it-inflection-point/articleshow/125616793.cms,"Representational image

IMF Applauds India’s Growth And Reforms, Bails Pakistan Again Out From Economic Burden

(With ANI inputs)





State Bank of Pakistan (SBP) governor Jameel Ahmad has warned that the country’s existing economic growth model “can no longer sustain” its population of 250 million (25 crore).“Our business cycles are shortening and as such, our current growth model simply cannot sustain a country of over 250 million people,” he remarked at the Pakistan Business Council’s Dialogue on the Economy on Wednesday, according to The Express Tribune.Ahmad, who has led the SBP since August 2022, noted that Pakistan’s growth trajectory had been “steadily weakening for decades” — slipping from an average of 3.9 per cent over the past 30 years, to 3.5 per cent in the last two decades, and further down to 3.4 per cent over the past five years.He added that Pakistan had been caught in a “prolonged phase of stabilisation,” during which, he said, citizens and businesses were burdened by steep taxes, high energy costs and unchecked government spending. He urged policymakers and private-sector leaders to move away from short-term fixes and adopt a long-term outlook.Calling the moment an “inflection point,” Ahmad pushed for a shift towards inclusive, sustainable growth, advocating structural reforms and urging businesses to expand their competitiveness by integrating into global value chains, modernising production, and avoiding “shortcuts” for quick profits.Ahmad also highlighted that Pakistan’s external debt nearly doubled from $55 billion to $100 billion between 2015 and 2022 without a corresponding rise in reserves. Since 2022, however, public external debt has remained broadly unchanged while SBP’s reserves have climbed from $2.9 billion to $14.5 billion, aided by $8.4 billion in market purchases during the last fiscal year.His remarks came a day after Planning Minister Ahsan Iqbal blamed the International Monetary Fund (IMF) for Pakistan’s highest unemployment rate in 21 years. Unemployment has risen to 7.1 per cent, while the World Bank estimates 44.7 per cent of Pakistanis now live below the poverty line.","State Bank of Pakistan (SBP) governor Jameel Ahmad has warned that the country’s existing economic growth model “can no longer sustain” its population of 250 million (25 crore) Ahmad said Pakistan had been caught in a “prolonged phase of stabilisation,” during which, he said, citizens and businesses were burdened by steep taxes, high energy costs and unchecked government spending.","https://static.toiimg.com/thumb/msid-125617122,imgsize-60374,width-400,resizemode-4/pakistan39s-current-growth-model-cannot-sustain-250-million-population-says-state-bank-governor.jpg"
AI reunites lost Pakistani woman with family: Kiran went missing at age 10,https://timesofindia.indiatimes.com/world/pakistan/ai-reunites-lost-pakistani-woman-with-family-kiran-went-missing-at-age-10-how-she-returned-home-after-17-years/articleshow/125608654.cms,".

What Is Artificial Intelligence? Explained Simply With Real-Life Examples





A young Pakistani woman, missing for 17 years, has been reunited with her family with the help of facial recognition technology and AI.Kiran, now 27, went missing in 2008 when she stepped out to buy ice cream in her Islamabad neighbourhood and forgot her home address. “I was lost and crying. A kind woman took me to the Edhi Centre in Islamabad as I couldn’t remember anything,” she said, news agency PTI reported.A few days later, Bilquis Edhi, wife of the late Abdul Sattar Edhi, founder of the Edhi Foundation, brought Kiran to the Karachi shelter home, where she grew up under Bilquis’ care. Sabah Faisal Edhi, wife of the current chairperson Faisal Edhi, said repeated attempts to trace Kiran’s parents through visits to Islamabad had failed.Earlier this year, the foundation contacted Nabeel Ahmed, a cybersecurity specialist with the Punjab Safe City Project. Using Kiran’s recent photos and limited childhood details, Nabeel accessed a missing-person police report from 2008 and, with facial recognition and tracking software, successfully located her family.Kiran’s father, Abdul Majeed, a tailor, travelled to Karachi to bring her home. “We searched for years, even published her photo in newspapers, but never found her.We had lost hope,” he said.Kiran expressed mixed emotions on returning home. “I am sad to leave my family members here. I will always be grateful to Bilquis apa and everyone at the shelter for taking such good care of me,” she said.She is the fifth girl from the Edhi shelter whose family has been traced with the foundation now working closely with police and Safe City Projects across Pakistan.","Kiran, now 27, went missing in 2008 when she stepped out to buy ice cream in her Islamabad neighbourhood and forgot her home address. Kiran’s father, Abdul Majeed, a tailor, travelled to Karachi to bring her home. She is the fifth girl from the Edhi shelter whose family has been traced with the foundation working closely with police and Safe City Projects across Pakistan.","https://static.toiimg.com/thumb/msid-125609108,imgsize-29004,width-400,resizemode-4/1280720-2025-11-27t134718091.jpg"
"B’desh court sentences Hasina & her niece, a UK lawmaker, in graft case",https://timesofindia.indiatimes.com/world/south-asia/bdesh-court-sentences-hasina-her-niece-a-uk-lawmaker-in-graft-case/articleshow/125707740.cms,"AP file photo

Sheikh Hasina, UK MP Tulip Siddiq Convicted in Corruption Case, Raising Concerns Over Fair Trials





Bangladesh’s former prime minister Sheikh Hasina , her sister Sheikh Rehana and Hasina’s niece and British MP Tulip Siddiq were on Monday sentenced to different terms of imprisonment for ‘irregularities’ in allocation of plots under the Purbachal New Town project.Judge Rabiul Alam of Dhaka Special Judge Court-4 pronounced the verdict. Hasina, already sentenced to death for crimes against humanity, was handed five years’ imprisonment, while Rehana got seven years and Tulip Siddiq two years of jail.The court found Siddiq, the Labour MP for Hampstead and Highgate, guilty of misusing her “special influence” as a British politician to coerce Hasina into giving valuable pieces of land to her mother and siblings.Bangladesh does not have an extradition treaty with the United Kingdom (UK), and it is unlikely Siddiq will serve the sentence. The Labour party said it was not recognising the corruption judgment against Siddiq because she was denied the opportunity to a fair legal process in the case.Siddiq had denied the charges, claiming that much of the evidence being presented by prosecutors was forged. She had been put on trial as a Bangladeshi citizen, with a passport and tax ID, even though she said she had not held a Bangladeshi passport since childhood and had never paid taxes there.Siddiq said, “This whole process has been flawed and farcical from the beginning to the end.” “The outcome of this kangaroo court is as predictable as it is unjustified. I hope this so-called ‘verdict’ will be treated with the contempt it deserves. My focus has always been my constituents in Hampstead and Highgate, and I refuse to be distracted by politics of Bangladesh,” the Guardian quoted her as saying.","Sheikh Hasina, UK MP Tulip Siddiq Convicted in Corruption Case, Raising Concerns Over Fair Trials. Hasina already sentenced to death for crimes against humanity. Siddiq found guilty of misusing her “special influence” as a British politician.","https://static.toiimg.com/thumb/msid-125707757,imgsize-1228958,width-400,resizemode-4/ap-file-photo.jpg"
Corruption charges: Bangladesh court convicts Sheikh Hasina to 5-year jail; niece Tulip Siddiq for 2 years,https://timesofindia.indiatimes.com/world/south-asia/corruption-charges-bangladesh-court-convicts-sheikh-hasina-to-5-year-jail-niece-tulip-siddiq-for-2-years/articleshow/125688818.cms,"Tulip Siddiq, left, stands beside Bangladesh's ex- leader Sheikh Hasina (Photo credit: AP)



Sheikh Hasina, UK MP Tulip Siddiq Convicted in Corruption Case, Raising Concerns Over Fair Trials





All 17 convicts were fined Tk 1 lakh each, with an additional six months in jail if fines remain unpaid, the state-run BSS news agency reported. The court also imposed a fine of $813 each on Hasina, Rehana, and Siddiq, and ordered the cancellation of the plot allotted to Rehana.According to The Dhaka Tribune, the Anti-Corruption Commission (ACC) filed six separate cases between January 12 and 14 over alleged irregularities in the allocation of plots under the Purbachal project. The ACC alleged that Hasina, in collusion with senior Rajuk officials, unlawfully secured six plots, each measuring 10 kathas (7,200 sq ft), in the diplomatic zone of Sector 27 for herself, her children Joy and Putul, sister Rehana, niece Siddiq, and other relatives, despite being ineligible under existing regulations. Charges were framed against 29 people, including Hasina’s children Sajeeb Wazed Joy and Saima Wazed Putul, as part of multiple cases filed in January 2025.Tulip Siddiq, who represents Hampstead and Highgate in Britain’s Parliament, had previously denied the allegations, calling the trial “a farce built on ‘fabricated accusations and driven by a clear political vendetta’.” In January, she resigned as economic secretary to the Treasury in Prime Minister Keir Starmer’s Cabinet, saying she had been cleared of wrongdoing but stepped down because the issue was becoming “a distraction from the work of the government,” AP quoted.This verdict is one among several against Hasina. Earlier this month, a separate Dhaka court sentenced her to 21 years in jail across three corruption cases over the same Purbachal project, with consecutive seven-year terms and fines of Tk 1 lakh per case. Joy and Putul were also sentenced to five years each in related cases, Dhaka Tribune reported. Mass protests toppled Hasina’s Awami League regime on August 5, 2024, ending her rule after which she took refuge in India. She had earlier been declared a fugitive by a Bangladeshi court. She was also sentenced to death in absentia in November for her role in the violent crackdown on student-led protests, termed the “July Uprising”, and had previously been declared a fugitive.Bangladesh’s foreign affairs adviser Mohammad Touhid Hossain said the interim government expects India to consider Hasina’s extradition “at the earliest possible time,” now that judicial proceedings against her are complete.The country is currently run by an interim government headed by Nobel laureate Muhammad Yunus, which has announced that the next parliamentary elections will be held in February.","All 17 convicts were fined Tk 1 lakh each, with an additional six months in jail if fines remain unpaid. The court also imposed a fine of $813 each on Hasina, Rehana, and Tulip Siddiq. Charges were framed against 29 people, including Hasina’s children.","https://static.toiimg.com/thumb/msid-125688830,imgsize-1212915,width-400,resizemode-4/image-2025-12-01t131111.jpg"
